<?xml version="1.0" encoding="utf-8"?><soap:Envelope xmlns:soap="http://schemas.xmlsoap.org/soap/envelope/" xmlns:xsi="http://www.w3.org/2001/XMLSchema-instance" xmlns:xsd="http://www.w3.org/2001/XMLSchema"><soap:Body><CautareDosareResponse xmlns="portalquery.just.ro"><CautareDosareResult><Dosar><parti><DosarParte><nume>Niculae Ştefan Cristian</nume><calitateParte>Reclamant</calitateParte></DosarParte><DosarParte><nume>Niculae Luminiţa Ecaterina</nume><calitateParte>Pârât</calitateParte></DosarParte><DosarParte><nume>AUTORITATEA TUTELARĂ-PRIMĂRIA SECTOR 4 BUCUREŞTI</nume><calitateParte>Autoritate tutelară</calitateParte></DosarParte></parti><sedinte><DosarSedinta><complet>C19 - civil, minori şi familie</complet><data>2018-10-16T00:00:00</data><ora>09:00</ora><solutie>Admite cererea</solutie><solutieSumar>Admite cererea de chemare în judecată.
Declară desfăcută din culpă comună căsătoria încheiată între părţi. 
Pârâta va relua numele de familie purtat anterior încheierii căsătoriei.
Autoritatea părintească cu privire la minoră va fi exercitată exclusiv de către mamă.  
Stabileşte locuinţa minorei la domiciliul mamei.
Din oficiu, obligă tatăl să plătească în favoarea minorei o pensie de întreţinere lunară în cotă 1  din venitul net minim pe economie, începând cu data pronunţării prezentei hotărâri şi până la majoratul beneficiarei. 
Ia act că nu s-au solicitat cheltuieli de judecată.
Executorie de drept în privinţa modalităţii de exercitare a autorităţii părinteşti, locuinţei minorei şi a pensiei de întreţinere stabilită în favoarea acesteia.
Cu drept de apel în termen de 30 de zile de la comunicare, cererea urmând a fi depusă la Judecătoria Sectorului 4 Bucureşti.
Dispune înaintarea prezentei hotărâri către Serviciul de Stare Civilă al Primăriei Sectorului 4 Bucureşti pentru efectuarea cuvenitelor menţiuni pe actul de căsătorie, după rămânerea sa definitivă.
Soluţie pusă la dispoziţia părţilor prin mijlocirea grefei instanţei, conform art. 396 alin. 2 din Codul de procedură civilă, astăzi, 16.10.2018.
</solutieSumar><dataPronuntare>2018-10-16T00:00:00</dataPronuntare><documentSedinta>Hotarare</documentSedinta><numarDocument>12912/2018</numarDocument><dataDocument>2018-10-16T00:00:00</dataDocument></DosarSedinta><DosarSedinta><complet>C19 - civil, minori şi familie</complet><data>2018-10-02T00:00:00</data><ora>11:00</ora><solutie>Amână pronunţarea</solutie><solutieSumar>Având nevoie de timp pentru a delibera, amână pronunţarea la data de 16.10.2018.
Pronunţată în şedinţă publică azi, 02.10.2018.


</solutieSumar><dataPronuntare xsi:nil="true" /><documentSedinta>incheiereAmanareinitialaapronuntarii</documentSedinta><numarDocument /><dataDocument>2018-10-02T00:00:00</dataDocument></DosarSedinta><DosarSedinta><complet>C19 - civil, minori şi familie</complet><data>2018-06-28T00:00:00</data><ora>09:00</ora><solutie>Amână cauza</solutie><solutieSumar /><dataPronuntare xsi:nil="true" /><documentSedinta xsi:nil="true" /><numarDocument /><dataDocument xsi:nil="true" /></DosarSedinta><DosarSedinta><complet>C19 - civil, minori şi familie</complet><data>2018-05-10T00:00:00</data><ora>09:00</ora><solutie>Amână cauza</solutie><solutieSumar /><dataPronuntare xsi:nil="true" /><documentSedinta xsi:nil="true" /><numarDocument /><dataDocument xsi:nil="true" /></DosarSedinta><DosarSedinta><complet>C19 - civil, minori şi familie</complet><data>2018-04-19T00:00:00</data><ora>09:00</ora><solutie>Amână cauza</solutie><solutieSumar /><dataPronuntare xsi:nil="true" /><documentSedinta xsi:nil="true" /><numarDocument /><dataDocument xsi:nil="true" /></DosarSedinta></sedinte><numar>180/4/2018</numar><numarVechi /><data>2018-01-04T12:52:00</data><institutie>JudecatoriaSECTORUL4BUCURESTI</institutie><departament>....</departament><categorieCaz>Minorisifamilie</categorieCaz><stadiuProcesual>Fond</stadiuProcesual><obiect>divorţ cu copii</obiect><dataModificare>2018-12-16T16:38:56.45</dataModificare><categorieCazNume>Minori şi familie</categorieCazNume><stadiuProcesualNume>Fond</stadiuProcesualNume></Dosar><Dosar><parti><DosarParte><nume>Pavel Mihaela Florentina</nume><calitateParte>Reclamant</calitateParte></DosarParte><DosarParte><nume>AUTORITATEA TUTELARĂ-PRIMĂRIA SECTOR 4 BUCUREŞTI</nume><calitateParte>Autoritate tutelară</calitateParte></DosarParte><DosarParte><nume>Pavel Andrei</nume><calitateParte>Pârât</calitateParte></DosarParte></parti><sedinte><DosarSedinta><complet>C15 - civil, minori şi familie</complet><data>2018-08-28T00:00:00</data><ora>09:00</ora><solutie>Ia act de renunţare la judecată</solutie><solutieSumar>Ia act de renuntarea reclamantei la judecata.
Cu recurs in termen de 30 de zile de la comunicare. 
Pronuntata in sedinta publica, azi, 28.08.2018.
</solutieSumar><dataPronuntare>2018-08-28T00:00:00</dataPronuntare><documentSedinta>Hotarare</documentSedinta><numarDocument>10831/2018</numarDocument><dataDocument>2018-08-28T00:00:00</dataDocument></DosarSedinta><DosarSedinta><complet>C15 - civil, minori şi familie</complet><data>2018-06-26T00:00:00</data><ora>09:00</ora><solutie>Amână cauza</solutie><solutieSumar /><dataPronuntare xsi:nil="true" /><documentSedinta xsi:nil="true" /><numarDocument /><dataDocument xsi:nil="true" /></DosarSedinta><DosarSedinta><complet>C15 - civil, minori şi familie</complet><data>2018-05-08T00:00:00</data><ora>09:00</ora><solutie>Amână cauza</solutie><solutieSumar /><dataPronuntare xsi:nil="true" /><documentSedinta xsi:nil="true" /><numarDocument /><dataDocument xsi:nil="true" /></DosarSedinta><DosarSedinta><complet>C15 - civil, minori şi familie</complet><data>2018-04-17T00:00:00</data><ora>09:00</ora><solutie>Amână cauza</solutie><solutieSumar /><dataPronuntare xsi:nil="true" /><documentSedinta xsi:nil="true" /><numarDocument /><dataDocument xsi:nil="true" /></DosarSedinta></sedinte><numar>253/4/2018</numar><numarVechi /><data>2018-01-05T10:47:00</data><institutie>JudecatoriaSECTORUL4BUCURESTI</institutie><departament>....</departament><categorieCaz>Minorisifamilie</categorieCaz><stadiuProcesual>Fond</stadiuProcesual><obiect>divorţ cu copii</obiect><dataModificare>2018-09-06T22:37:02.697</dataModificare><categorieCazNume>Minori şi familie</categorieCazNume><stadiuProcesualNume>Fond</stadiuProcesualNume></Dosar><Dosar><parti><DosarParte><nume>Iancu Ion</nume><calitateParte>Reclamant</calitateParte></DosarParte><DosarParte><nume>AUTORITATEA TUTELARĂ-PRIMĂRIA SECTOR 4 BUCUREŞTI</nume><calitateParte>Autoritate tutelară</calitateParte></DosarParte><DosarParte><nume>Iancu Andra Elena</nume><calitateParte>Pârât</calitateParte></DosarParte></parti><sedinte><DosarSedinta><complet>C13 - civil, minori şi familie</complet><data>2019-05-24T00:00:00</data><ora>08:30</ora><solutie>Constată perimată cererea</solutie><solutieSumar>În baza art. 416 C.pr.civ. admite excepţia perimării acţiunii.
Constată perimată actiunea formulată de reclamantul Iancu Ion, în contradictoriu cu pârâta Iancu Andra Elena, având ca obiect divorţ . 
Cu drept de recurs în 5 zile de la pronunţare.
	Pronunţată în şedinţă publică, azi 24.05.2019.
</solutieSumar><dataPronuntare>2019-05-24T00:00:00</dataPronuntare><documentSedinta>Hotarare</documentSedinta><numarDocument>6561/2019</numarDocument><dataDocument>2019-05-24T00:00:00</dataDocument></DosarSedinta><DosarSedinta><complet>C13 - civil, minori şi familie</complet><data>2018-09-28T00:00:00</data><ora>08:30</ora><solutie>411 NCPC/242 CPC</solutie><solutieSumar>In baza art. 411 alin 1 pct. 1 cod.proc.civ suspenda solu?ionarea cererii având ca obiect divor? formulata de Iancu Ion in contradictoriu cu Iancu Andra Elena
Cu drept de recurs pe toata perioada suspendării.
Pronunţată în şedinţa publică din data de 28.09.2018

</solutieSumar><dataPronuntare>2018-09-28T00:00:00</dataPronuntare><documentSedinta>incheiereSuspendare</documentSedinta><numarDocument /><dataDocument>2018-09-28T00:00:00</dataDocument></DosarSedinta><DosarSedinta><complet>C13 - civil, minori şi familie</complet><data>2018-02-13T00:00:00</data><ora>08:30</ora><solutie>Anulează cererea</solutie><solutieSumar>Anulează cererea formulată de reclamantul Iancu Ion, având ca obiect  partaj.
Cu drept de cerere de reexaminare in termen de 15 zile de la comunicare.
	Data in camera de consiliu si pronunţată în şedinţa publică din data de 13.02.2018.
</solutieSumar><dataPronuntare>2018-02-13T00:00:00</dataPronuntare><documentSedinta>Incheiereanularecerere</documentSedinta><numarDocument /><dataDocument>2018-02-13T00:00:00</dataDocument></DosarSedinta></sedinte><numar>504/4/2018</numar><numarVechi /><data>2018-01-09T09:16:00</data><institutie>JudecatoriaSECTORUL4BUCURESTI</institutie><departament>....</departament><categorieCaz>Minorisifamilie</categorieCaz><stadiuProcesual>Fond</stadiuProcesual><obiect>divorţ cu copii-PERIMARE</obiect><dataModificare>2019-06-20T15:47:44.89</dataModificare><categorieCazNume>Minori şi familie</categorieCazNume><stadiuProcesualNume>Fond</stadiuProcesualNume></Dosar><Dosar><parti><DosarParte><nume>Creţiu Bălan Elena</nume><calitateParte>Reclamant</calitateParte></DosarParte><DosarParte><nume>Bălan Cătălin Adrian</nume><calitateParte>Pârât</calitateParte></DosarParte></parti><sedinte><DosarSedinta><complet>C15 - civil, minori şi familie</complet><data>2018-11-12T00:00:00</data><ora>09:00</ora><solutie>Constată perimată cererea</solutie><solutieSumar>Admite sesizarea din oficiu.
Constata perimata cererea.
Cu recurs în termen de 5 zile de la pronunţare.
Pronunţată în şedinţă publică, azi, 12.11.2018.
</solutieSumar><dataPronuntare>2018-11-12T00:00:00</dataPronuntare><documentSedinta>Hotarare</documentSedinta><numarDocument>14415/2018</numarDocument><dataDocument>2018-11-12T00:00:00</dataDocument></DosarSedinta><DosarSedinta><complet>C15 - civil, minori şi familie</complet><data>2018-04-17T00:00:00</data><ora>09:00</ora><solutie>411 NCPC/242 CPC</solutie><solutieSumar>Suspenda judecarea cauzei ca efect al lipsei partilor.
Cu recurs pe toata durata suspendarii.
Pronuntata in sedinta publica, azi, 17.04.2018.</solutieSumar><dataPronuntare>2018-04-17T00:00:00</dataPronuntare><documentSedinta>incheiereSuspendare</documentSedinta><numarDocument /><dataDocument>2018-04-17T00:00:00</dataDocument></DosarSedinta></sedinte><numar>509/4/2018</numar><numarVechi /><data>2018-01-09T10:03:00</data><institutie>JudecatoriaSECTORUL4BUCURESTI</institutie><departament>....</departament><categorieCaz>Minorisifamilie</categorieCaz><stadiuProcesual>Fond</stadiuProcesual><obiect>divorţ fara copii</obiect><dataModificare>2018-12-21T13:59:23.717</dataModificare><categorieCazNume>Minori şi familie</categorieCazNume><stadiuProcesualNume>Fond</stadiuProcesualNume></Dosar><Dosar><parti><DosarParte><nume>Apreotesei Gabriela</nume><calitateParte>Reclamant</calitateParte></DosarParte><DosarParte><nume>Apreotesei Petru</nume><calitateParte>Pârât</calitateParte></DosarParte></parti><sedinte><DosarSedinta><complet>C23 - civil, minori şi familie</complet><data>2018-06-15T00:00:00</data><ora>09:00</ora><solutie>Declină soluţionarea cauzei</solutie><solutieSumar>Admite excepţia necompetenţei teritoriale a Judecătoriei Sector 4 Bucureşti. 
	Declină competenţa de soluţionare a cererii în favoarea Judecătoriei Paşcani. 
	Fără cale de atac. 
	Pronunţată în şedinţă publică, azi 15.06.2018. 
</solutieSumar><dataPronuntare>2018-06-15T00:00:00</dataPronuntare><documentSedinta>Hotarare</documentSedinta><numarDocument>7973/2018</numarDocument><dataDocument>2018-06-15T00:00:00</dataDocument></DosarSedinta><DosarSedinta><complet>C23 - civil, minori şi familie</complet><data>2018-06-08T00:00:00</data><ora>09:00</ora><solutie>Amână cauza</solutie><solutieSumar>Amână pronunţarea la 15.06.2018. 
Pronunţată în şedinţă publică, azi 08.06.2018.
</solutieSumar><dataPronuntare xsi:nil="true" /><documentSedinta>incheiereAmanareinitialaapronuntarii</documentSedinta><numarDocument /><dataDocument>2018-06-08T00:00:00</dataDocument></DosarSedinta></sedinte><numar>534/4/2018</numar><numarVechi /><data>2018-01-09T10:36:00</data><institutie>JudecatoriaSECTORUL4BUCURESTI</institutie><departament>....</departament><categorieCaz>Minorisifamilie</categorieCaz><stadiuProcesual>Fond</stadiuProcesual><obiect>divorţ fara copii</obiect><dataModificare>2018-08-27T17:32:22.497</dataModificare><categorieCazNume>Minori şi familie</categorieCazNume><stadiuProcesualNume>Fond</stadiuProcesualNume></Dosar><Dosar><parti><DosarParte><nume>Sârbu Mihaela</nume><calitateParte>Reclamant</calitateParte></DosarParte><DosarParte><nume>Sârbu Constantin</nume><calitateParte>Pârât</calitateParte></DosarParte></parti><sedinte><DosarSedinta><complet>C19 - civil, minori şi familie</complet><data>2019-06-18T00:00:00</data><ora>09:00</ora><solutie>Admite in parte cererea</solutie><solutieSumar>Admite excepţia autorităţii de lucru judecat cu privire la capătul de cerere având ca obiect desfacerea căsătoriei prin divorţ, invocată din oficiu.
Respinge cererea având ca obiect desfacerea căsătoriei prin divorţ formulată de reclamantă, în cauză existând autoritate de lucru judecat. 
Respinge cererea reclamantei de revenire la numele purtat anterior încheierii căsătoriei, ca inadmisibilă.
Admite în parte cererea principală privind partajarea bunurilor comune dobândite de părţi în cursul căsătoriei.
Admite în parte cererea reconvenţională.
Constată că în cursul căsătoriei lor, părţile au dobândit cu titlu de bun comun prin cumpărare, cu contribuţii şi în cote egale de câte 50%, imobilul situat în Bucureşti, str. Odei, în valoare de 37.000 euro.
Partajează imobilul menţionat în sensul că îl atribuie în întregime în deplină proprietate şi liniştită posesie şi folosinţă pârâtului, cu obligarea acestuia la plata unei sulte în cuantum de 18.500 euro în favoarea reclamantei în termen de 6 luni de la rămânerea definitivă a prezentei hotărâri.
Constată că în timpul căsătoriei lor părţile au contractat o datorie comună în cuantum de 20.000 euro, aceasta urmând a fi suportată de foştii soţi - reclamanta şi pârâtul, în părţi egale.
Compensează partea din datoria comună ce revine reclamantei cu parte din sulta pe care pârâtul i-o datorează, respectiv până la concurenţa sumei de 10.000 euro.
Obligă reclamanta la plata sumei de 4.245 lei cheltuieli de judecată în favoarea pârâtului.
Cu drept de apel în termen de 30 de zile de la comunicare, cererea urmând a fi depusă la Judecătoria Sectorului 4 Bucureşti.
Soluţie pronunţată şi pusă la dispoziţia părţilor prin mijlocirea grefei instanţei azi, 18.06.2019.  
</solutieSumar><dataPronuntare>2019-06-18T00:00:00</dataPronuntare><documentSedinta>Hotarare</documentSedinta><numarDocument>7879/2019</numarDocument><dataDocument>2019-06-18T00:00:00</dataDocument></DosarSedinta><DosarSedinta><complet>C19 - civil, minori şi familie</complet><data>2019-06-04T00:00:00</data><ora>09:00</ora><solutie>Amână cauza</solutie><solutieSumar>Având nevoie de timp suplimentar pentru a delibera, amână pronunţarea la data de 18.06.2019.
 Pronunţată prin punerea soluţiei la dispoziţia părţilor prin mijlocirea grefei instanţei astăzi, 04.06.2019.

</solutieSumar><dataPronuntare>2019-06-04T00:00:00</dataPronuntare><documentSedinta>incheiereAmanareulterioaraapronuntarii</documentSedinta><numarDocument /><dataDocument>2019-06-04T00:00:00</dataDocument></DosarSedinta><DosarSedinta><complet>C19 - civil, minori şi familie</complet><data>2019-05-21T00:00:00</data><ora>09:00</ora><solutie>Amână pronunţarea</solutie><solutieSumar>Având nevoie de timp suplimentar pentru a delibera, amână pronunţarea la data de 04.06.2019.
 Pronunţată prin punerea soluţiei la dispoziţia părţilor prin mijlocirea grefei instanţei astăzi, 21.05.2019.
</solutieSumar><dataPronuntare xsi:nil="true" /><documentSedinta>incheiereAmanareulterioaraapronuntarii</documentSedinta><numarDocument /><dataDocument>2019-05-21T00:00:00</dataDocument></DosarSedinta><DosarSedinta><complet>C19 - civil, minori şi familie</complet><data>2019-05-07T00:00:00</data><ora>09:00</ora><solutie>Amână pronunţarea</solutie><solutieSumar>
Având nevoie de timp pentru a delibera, amână pronunţarea la data de 21.05.2019.
Pronunţată prin punerea soluţiei la dispoziţia părţilor prin mijlocirea grefei instanţei azi, 07.05.2019.

</solutieSumar><dataPronuntare xsi:nil="true" /><documentSedinta>incheiereAmanareinitialaapronuntarii</documentSedinta><numarDocument /><dataDocument>2019-05-07T00:00:00</dataDocument></DosarSedinta><DosarSedinta><complet>C19 - civil, minori şi familie</complet><data>2019-03-19T00:00:00</data><ora>09:00</ora><solutie>Amână cauza</solutie><solutieSumar /><dataPronuntare xsi:nil="true" /><documentSedinta xsi:nil="true" /><numarDocument /><dataDocument xsi:nil="true" /></DosarSedinta><DosarSedinta><complet>C19 - civil, minori şi familie</complet><data>2019-02-05T00:00:00</data><ora>12:00</ora><solutie>Amână cauza</solutie><solutieSumar /><dataPronuntare xsi:nil="true" /><documentSedinta>incheieredesedinta</documentSedinta><numarDocument /><dataDocument>2019-02-05T00:00:00</dataDocument></DosarSedinta><DosarSedinta><complet>C19 - civil, minori şi familie</complet><data>2018-12-04T00:00:00</data><ora>09:00</ora><solutie>Amână cauza</solutie><solutieSumar /><dataPronuntare xsi:nil="true" /><documentSedinta xsi:nil="true" /><numarDocument /><dataDocument xsi:nil="true" /></DosarSedinta><DosarSedinta><complet>C19 - civil, minori şi familie</complet><data>2018-11-13T00:00:00</data><ora>09:00</ora><solutie>Amână cauza</solutie><solutieSumar /><dataPronuntare xsi:nil="true" /><documentSedinta xsi:nil="true" /><numarDocument /><dataDocument xsi:nil="true" /></DosarSedinta><DosarSedinta><complet>C19 - civil, minori şi familie</complet><data>2018-09-11T00:00:00</data><ora>09:00</ora><solutie>Amână cauza</solutie><solutieSumar /><dataPronuntare xsi:nil="true" /><documentSedinta>incheieredesedinta</documentSedinta><numarDocument /><dataDocument>2018-09-11T00:00:00</dataDocument></DosarSedinta></sedinte><numar>571/4/2018</numar><numarVechi /><data>2018-01-09T12:09:00</data><institutie>JudecatoriaSECTORUL4BUCURESTI</institutie><departament>....</departament><categorieCaz>Minorisifamilie</categorieCaz><stadiuProcesual>Fond</stadiuProcesual><obiect>divorţ fara copii</obiect><dataModificare>2019-12-09T19:09:38.877</dataModificare><categorieCazNume>Minori şi familie</categorieCazNume><stadiuProcesualNume>Fond</stadiuProcesualNume></Dosar><Dosar><parti><DosarParte><nume>Coşar Marilena Graţiela</nume><calitateParte>Reclamant</calitateParte></DosarParte><DosarParte><nume>AUTORITATEA TUTELARĂ-PRIMĂRIA SECTOR 4 BUCUREŞTI</nume><calitateParte>Autoritate tutelară</calitateParte></DosarParte><DosarParte><nume>Coşar Marian Dănuţ</nume><calitateParte>Pârât</calitateParte></DosarParte></parti><sedinte><DosarSedinta><complet>C15 - civil, minori şi familie</complet><data>2018-08-28T00:00:00</data><ora>09:00</ora><solutie>Respinge cererea</solutie><solutieSumar>Respinge actiunea, ca nesustinuta.
Cu apel in termen de 30 de zile de la comunicare. 
Pronuntata in sedinta publica, azi, 28.08.2018.
</solutieSumar><dataPronuntare>2018-08-28T00:00:00</dataPronuntare><documentSedinta>Hotarare</documentSedinta><numarDocument>10832/2018</numarDocument><dataDocument>2018-08-28T00:00:00</dataDocument></DosarSedinta><DosarSedinta><complet>C15 - civil, minori şi familie</complet><data>2018-06-26T00:00:00</data><ora>09:00</ora><solutie>Amână cauza</solutie><solutieSumar /><dataPronuntare xsi:nil="true" /><documentSedinta xsi:nil="true" /><numarDocument /><dataDocument xsi:nil="true" /></DosarSedinta><DosarSedinta><complet>C15 - civil, minori şi familie</complet><data>2018-05-08T00:00:00</data><ora>09:00</ora><solutie>Amână cauza</solutie><solutieSumar /><dataPronuntare xsi:nil="true" /><documentSedinta xsi:nil="true" /><numarDocument /><dataDocument xsi:nil="true" /></DosarSedinta></sedinte><numar>1235/4/2018</numar><numarVechi /><data>2018-01-17T12:25:00</data><institutie>JudecatoriaSECTORUL4BUCURESTI</institutie><departament>....</departament><categorieCaz>Minorisifamilie</categorieCaz><stadiuProcesual>Fond</stadiuProcesual><obiect>divorţ cu copii</obiect><dataModificare>2018-09-07T17:01:48.013</dataModificare><categorieCazNume>Minori şi familie</categorieCazNume><stadiuProcesualNume>Fond</stadiuProcesualNume></Dosar><Dosar><parti><DosarParte><nume>Prodan Olimpia Elena</nume><calitateParte>Reclamant</calitateParte></DosarParte><DosarParte><nume>AUTORITATEA TUTELARĂ-PRIMĂRIA SECTOR 4 BUCUREŞTI</nume><calitateParte>Autoritate tutelară</calitateParte></DosarParte><DosarParte><nume>Prodan Ionuţ Mihail</nume><calitateParte>Pârât</calitateParte></DosarParte><DosarParte><nume>AUTORITATEA TUTELARĂ - PRIMĂRIA ROŞIORII DE VEDE</nume><calitateParte>Autoritate tutelară</calitateParte></DosarParte></parti><sedinte><DosarSedinta><complet>C38 - civil, minori şi familie</complet><data>2018-10-11T00:00:00</data><ora>09:00</ora><solutie>Admite cererea</solutie><solutieSumar>Admite cererea principală, astfel cum a fost precizată.
Admite cererea reconvenţională, astfel cum a fost precizată.
Desface căsătoria părţilor încheiată la data de (...) şi înregistrată în Registrul de Stare Civilă al Primăriei Sectorului 4 Bucureşti sub nr. (...), prin acord.
Dispune păstrarea de către reclamanta-pârâtă a numelui dobândit prin căsătorie.
Dispune ca autoritatea părintească asupra minorei P.N.A., să fie exercitată în comun, de către ambii părinţi.
Stabileşte domiciliul minorei P.N.A., la mamă.
Obligă pârâtul-reclamant la plata în favoarea minorei P.N.A., a unei pensii de întreţinere de 1/4 lunar, din venitul minim pe economie, de la data introducerii acţiunii (18.01.2018) şi până la majoratul minorei. 
Încuviinţează pârâtului-reclamant legături personale cu minorei P.N.A., după următorul program: 
-	în prima şi a treia săptămână din lună, de vineri ora 16.00 până duminică ora 16.00, cu luarea şi aducerea minorului de la, respectiv la domiciliul mamei.
-	în vacanţa de iarnă – în anii pari, minora va petrece sărbătorile de iarnă cu tata, iar în anii impari, cu mama
-         sărbătorile de Paşte – în anii impari, minora va petrece aceste sărbători cu tata, iar în anii pari, cu mama
-         minora va petrece ziua sa de naştere cu tata, în anii pari şi cu mama, în anii impari
-         în vacanţa de vară – minora va petrece prima jumătate cu tata, în anii pari şi a doua jumatate cu tata, iar în anii impari.
-         programul de vizitare va putea fi modificat de părţi de comun acord, în interesul minorei.
Ia act că nu s-au solicitat cheltuieli de judecată.
Definitivă. 
Pronunţată în şedinţă publică, astăzi, 11.10.2018.
</solutieSumar><dataPronuntare>2018-10-11T00:00:00</dataPronuntare><documentSedinta>Hotarare</documentSedinta><numarDocument>12688/2018</numarDocument><dataDocument>2018-10-11T00:00:00</dataDocument></DosarSedinta><DosarSedinta><complet>C38 - civil, minori şi familie</complet><data>2018-09-20T00:00:00</data><ora>09:00</ora><solutie>Amână cauza</solutie><solutieSumar /><dataPronuntare xsi:nil="true" /><documentSedinta>incheieredesedinta</documentSedinta><numarDocument /><dataDocument>2018-09-20T00:00:00</dataDocument></DosarSedinta><DosarSedinta><complet>C38 - civil, minori şi familie</complet><data>2018-06-18T00:00:00</data><ora>09:00</ora><solutie>Amână cauza</solutie><solutieSumar /><dataPronuntare xsi:nil="true" /><documentSedinta>incheieredesedinta</documentSedinta><numarDocument /><dataDocument>2018-06-18T00:00:00</dataDocument></DosarSedinta><DosarSedinta><complet>C38 - civil, minori şi familie</complet><data>2018-04-23T00:00:00</data><ora>09:00</ora><solutie>411 NCPC/242 CPC</solutie><solutieSumar>În temeiul dispoziţiilor art.411 alin.1 pct.2 C.proc.civ, suspendă judecarea cauzei până la o nouă stăruinţă a părţilor. 
Cu recurs pe toata durata suspendării.
Pronunţată în şedinţă publică, astăzi, 23.04.2018.
</solutieSumar><dataPronuntare>2018-04-23T00:00:00</dataPronuntare><documentSedinta>incheiereSuspendare</documentSedinta><numarDocument /><dataDocument>2018-04-23T00:00:00</dataDocument></DosarSedinta></sedinte><numar>1335/4/2018</numar><numarVechi /><data>2018-01-18T12:02:00</data><institutie>JudecatoriaSECTORUL4BUCURESTI</institutie><departament>....</departament><categorieCaz>Minorisifamilie</categorieCaz><stadiuProcesual>Fond</stadiuProcesual><obiect>divorţ cu copii</obiect><dataModificare>2018-11-10T22:52:30.757</dataModificare><categorieCazNume>Minori şi familie</categorieCazNume><stadiuProcesualNume>Fond</stadiuProcesualNume></Dosar><Dosar><parti><DosarParte><nume>Bucătaru George Ovidiu</nume><calitateParte>Reclamant</calitateParte></DosarParte><DosarParte><nume>AUTORITATEA TUTLEARĂ-PRIMĂRIA SECTOR 4 BUCUREŞTI</nume><calitateParte>Autoritate tutelară</calitateParte></DosarParte><DosarParte><nume>Bucătaru Sorina Otilia</nume><calitateParte>Pârât</calitateParte></DosarParte></parti><sedinte><DosarSedinta><complet>C19 - civil, minori şi familie</complet><data>2019-03-05T00:00:00</data><ora>09:00</ora><solutie>Admite in parte cererea</solutie><solutieSumar>
Admite în parte cererea de chemare în judecată principală precizată.
Admite în parte cererea reconvenţională precizată.
Admite în parte cererea de chemare în judecată formulată în dosarul conex nr.1866/4/2018. 
Declară desfăcută prin acordul soţilor căsătoria . 
Pârâta va reveni la numele purtat anterior încheierii căsătoriei.
Ia act de înţelegerea parţială a părţilor cu privire la soluţionarea cererilor accesorii (autoritate părintească, locuinţă minoră, pensie de întreţinere) în sensul că:
Autoritatea părintească privind minora va fi exercitată în comun de către ambii părinţi.
Stabileşte locuinţa minorei la domiciliul mamei in Bucuresti, sector 1.
         Încuviinţează tatălui exercitarea dreptului la legături personale cu minora, fără prezen?a mamei pârâte, prin luarea acesteia din locuinţa mamei şi cu obligaţia de a o readuce la această locuinţă la finalizarea perioadei de legături personale, conform următorului program:
            În perioada cursurilor preşcolare/şcolare:
-	la fiecare două săptămâni (în fiecare sfârşit de săptămână pară din an), începând de vineri de la ora 18.00 până duminică la ora 18:00;
-	în fiecare zi de miercuri din cursul săptămânii, de la terminarea orelor de curs până a doua zi dimineaţa, cu dreptul reclamantului de a lua minora de la grădiniţă/şcoală la locuinţa sa/părinţilor săi şi a o duce joi dimineaţa la grădiniţă/şcoală.
                 În perioada vacanţelor şcolare:
-	prima jumătate a vacanţelor şcolare de iarnă, primăvară şi intersemestriale în anii pari la tată şi a doua la mamă, iar în anii impari invers, începând cu ora 10.00 în prima zi şi până la ora 18.00 în ultima zi.
-	în vacanţa de vară, în anii pari în perioadele 01 – 15 iulie şi 01 – 15 august, iar în anii impari în perioadele 15 – 31 iulie şi 15 – 31 august, începând cu ora 10.00 în prima zi şi până la ora 18.00 în ultima zi.
               Zile de naştere, onomastică şi sărbători legale: 
-	zilele de 20 ianuarie şi 27 decembrie din anii pari (ziua de naştere şi onomastica minorei), cu luarea minorei din locuin?a mamei la ora 18.00 în ziua anterioară (19 ianuarie şi 26 decembrie) ?i readucerea minorei la locuinţa mamei în data de 21 ianuarie, respectiv 28 decembrie la ora 19.00;
-	Sărbătorile Pascale catolice în anii pari, de sâmbătă ora 10.00 până luni ora 19.00; 
-	sărbătorile legale, respectiv zilele de 24 Ianuarie, 1 Mai, 1 Iunie, Rusaliile, Sf. Andrei şi 1 Decembrie alternativ de la an la an începând cu 1 Mai 2019, cu luarea minorei din locuin?a mamei la ora 18.00 în ziua anterioară fiecărei sărbători şi readucerea la locuinţa acesteia în data sărbătorii respective la ora 19.00, cu excep?ia zilelor de Sf. Andrei şi 1 Decembrie, când tatăl va readuce minora la locuinţa mamei în data de 1 Decembrie la ora 19.00.

Obligă pârâta să asigure comunicarea video (telefonică sau prin internet) a minorei cu tatăl său, de cel puţin trei ori pe săptămână în zilele în care minora nu se află la tată, la ore rezonabile pentru minoră.
Obligă pârâta să transmită reclamantului informaţii referitoare la minoră cel puţin o dată la două săptămâni, legate de starea de sănătate a minorei, medicul pediatru/de familie la care este înscrisă minora, situaţia şcolară a acesteia, activităţi extraşcolare, deplasări etc.  
Obligă reclamantul la plata unei pensii de întreţinere în favoarea minorei în cuantum de 2.000 lei lunar, începând cu data pronunţării prezentei hotărâri ?i până la majoratul beneficiarei.
Reduce cuantumul onorariului de avocat suportat de către reclamant de la suma de 7.375 lei la suma de 2.000 lei şi compensează în integralitate cheltuielile de judecată efectuate de părţi în prezentul dosar.
Executorie de drept în ceea ce priveşte modul de exercitare a autorităţii părinteşti, stabilirea locuinţei minorei, modul de exercitare a dreptului de a avea legături personale cu minora şi pensia de întreţinere stabilită în favoarea minorei.
Definitivă pe aspectul divorţului, numelui pârâtei, autorităţii părinteşti şi locuinţei minorei.
Cu apel în 30 de zile de la comunicare pe aspectul programului de legături personale, cerere de apel care se depune la Judecătoria Sectorului 4 Bucure?ti.
Soluţie pusă la dispoziţia părţilor prin mijlocirea grefei instanţei, conform art. 396 alin. 2 din Codul de procedură civilă, astăzi, 05.03.2019.

	
</solutieSumar><dataPronuntare>2019-03-05T00:00:00</dataPronuntare><documentSedinta>Hotarare</documentSedinta><numarDocument>2683/2019</numarDocument><dataDocument>2019-03-05T00:00:00</dataDocument></DosarSedinta><DosarSedinta><complet>C19 - civil, minori şi familie</complet><data>2019-02-26T00:00:00</data><ora>09:00</ora><solutie>Amână pronunţarea</solutie><solutieSumar>
Având nevoie de timp suplimentar pentru a delibera, amână pronunţarea la data de 05.03.2019.
 Pronunţată prin punerea soluţiei la dispoziţia părţilor prin mijlocirea grefei instanţei, astăzi, 26.02.2019.
</solutieSumar><dataPronuntare xsi:nil="true" /><documentSedinta>incheiereAmanareulterioaraapronuntarii</documentSedinta><numarDocument /><dataDocument>2019-02-26T00:00:00</dataDocument></DosarSedinta><DosarSedinta><complet>C19 - civil, minori şi familie</complet><data>2019-02-12T00:00:00</data><ora>09:00</ora><solutie>Amână cauza</solutie><solutieSumar>Având nevoie de timp suplimentar pentru a delibera, amână pronunţarea la data de 26.02.2019.
 Pronunţată prin punerea soluţiei la dispoziţia părţilor prin mijlocirea grefei instanţei, astăzi, 12.02.2019.
</solutieSumar><dataPronuntare>2019-02-12T00:00:00</dataPronuntare><documentSedinta>incheiereAmanareulterioaraapronuntarii</documentSedinta><numarDocument /><dataDocument>2019-02-12T00:00:00</dataDocument></DosarSedinta><DosarSedinta><complet>C19 - civil, minori şi familie</complet><data>2019-01-29T00:00:00</data><ora>09:00</ora><solutie>Amână cauza</solutie><solutieSumar>Având nevoie de timp suplimentar pentru a delibera, amână pronunţarea la data de 12.02.2019.
 Pronunţată prin punerea soluţiei la dispoziţia părţilor prin mijlocirea grefei instanţei, astăzi, 29.01.2019.

</solutieSumar><dataPronuntare>2019-01-29T00:00:00</dataPronuntare><documentSedinta>incheiereAmanareulterioaraapronuntarii</documentSedinta><numarDocument /><dataDocument>2019-01-29T00:00:00</dataDocument></DosarSedinta><DosarSedinta><complet>C19 - civil, minori şi familie</complet><data>2019-01-15T00:00:00</data><ora>09:00</ora><solutie>Amână pronunţarea</solutie><solutieSumar>Având nevoie de timp pentru a delibera, amână pronunţarea la data de 29.01.2019.
Pronunţată în şedinţă publică azi, 15.01.2019.
</solutieSumar><dataPronuntare xsi:nil="true" /><documentSedinta>incheiereAmanareinitialaapronuntarii</documentSedinta><numarDocument /><dataDocument>2019-01-15T00:00:00</dataDocument></DosarSedinta><DosarSedinta><complet>C19 - civil, minori şi familie</complet><data>2018-11-13T00:00:00</data><ora>09:00</ora><solutie>Încheiere</solutie><solutieSumar>Prorogă pronunţarea asupra înţelegerii părţilor consemnată în înscrisul intitulat „Tranzacţie” încheiată între părţi la data de 13.11.2018 cu privire la desfacerea căsătoriei prin acord, revenirea pârâtei la numele purtat anterior căsătoriei şi exercitarea în comun de către ambii părinţi a autorităţii părinteşti cu privire la minoră până la pronunţarea hotărârii asupra fondului tuturor capetelor de cerere pentru care se continuă judecata.
	Pronunţată în şedinţă publică astăzi, 13.11.2018.
</solutieSumar><dataPronuntare xsi:nil="true" /><documentSedinta>incheieredesedinta</documentSedinta><numarDocument /><dataDocument>2018-11-13T00:00:00</dataDocument></DosarSedinta><DosarSedinta><complet>C19 - civil, minori şi familie</complet><data>2018-10-02T00:00:00</data><ora>09:00</ora><solutie>Amână cauza</solutie><solutieSumar /><dataPronuntare xsi:nil="true" /><documentSedinta xsi:nil="true" /><numarDocument /><dataDocument xsi:nil="true" /></DosarSedinta><DosarSedinta><complet>C13 - civil, minori şi familie</complet><data>2018-06-29T00:00:00</data><ora>08:30</ora><solutie>Amână cauza</solutie><solutieSumar>Admite declaraţia de abţinere formulată de d-na judecător Stanciu Roxana .
Constată că d-na judecător Stanciu Roxana  se află în cazul de incompatibilitate prevăzut de dispoziţiile art. 42 alin. (1) pct 1  Cod proc.civ.
Dosarul se va repartiza aleatoriu în Sistemul ECRIS.
	Definitiva .
          	Dată în camera de consiliu şi pronunţată în şedinţa publică din data de 29.06.2018.


</solutieSumar><dataPronuntare>2018-06-29T00:00:00</dataPronuntare><documentSedinta>incheiereabtinere</documentSedinta><numarDocument /><dataDocument>2018-06-29T00:00:00</dataDocument></DosarSedinta><DosarSedinta><complet>C2 - civil şi executări (fost minori şi familie)</complet><data>2018-06-19T00:00:00</data><ora>09:00</ora><solutie>Amână cauza</solutie><solutieSumar /><dataPronuntare xsi:nil="true" /><documentSedinta>incheieredesedinta</documentSedinta><numarDocument /><dataDocument>2018-06-19T00:00:00</dataDocument></DosarSedinta></sedinte><caiAtac><DosarCaleAtac><dataDeclarare>2019-07-29T00:00:00</dataDeclarare><parteDeclaratoare> Bucătaru Sorina Otilia, </parteDeclaratoare><tipCaleAtac>Apel</tipCaleAtac></DosarCaleAtac></caiAtac><numar>1816/4/2018</numar><numarVechi /><data>2018-01-25T10:03:00</data><institutie>JudecatoriaSECTORUL4BUCURESTI</institutie><departament>....</departament><categorieCaz>Minorisifamilie</categorieCaz><stadiuProcesual>Fond</stadiuProcesual><obiect>divorţ cu copii</obiect><dataModificare>2019-08-19T15:43:56.81</dataModificare><categorieCazNume>Minori şi familie</categorieCazNume><stadiuProcesualNume>Fond</stadiuProcesualNume></Dosar><Dosar><parti><DosarParte><nume>Bârnoveanu Lidia</nume><calitateParte>Reclamant</calitateParte></DosarParte><DosarParte><nume>AUTORITATEA TUTELARĂ-PRIMĂRIA SECTOR 4 BUCUREŞTI</nume><calitateParte>Autoritate tutelară</calitateParte></DosarParte><DosarParte><nume>Bârnoveanu Vasilică</nume><calitateParte>Pârât</calitateParte></DosarParte></parti><sedinte><DosarSedinta><complet>C2 - civil şi executări (fost minori şi familie)</complet><data>2018-09-03T00:00:00</data><ora>09:00</ora><solutie>Încheiere</solutie><solutieSumar>În temeiul art. 442 C.proc.civ., dispune îndreptarea erorii materiale strecurate în sentinţa civilă nr. 8097/19.06.2018 pronunţată de Judecătoria Sectorului 4 Bucureşti în dosarul nr. 2186/4/2018 privind pe reclamanta-pârâtă Bârnoveanu Lidia, în contradictoriu cu pârâtul-reclamant Bârnoveanu Vasilică, având ca obiect divorţ cu copii, în sensul că în dispozitivul hotărârii se va menţiona corect codul numeric personal al reclamantei-pârâte Bârnoveanu Lidia ca fiind „28........”, în loc de „23.........”, cum din eroare s-a menţionat.
Definitivă.
Dată în camera de consiliu şi pronunţată în şedinţă publică azi, 03.09.2018.

</solutieSumar><dataPronuntare>2018-09-03T00:00:00</dataPronuntare><documentSedinta>incheiereindreptareeroaremateriala</documentSedinta><numarDocument /><dataDocument>2018-09-03T00:00:00</dataDocument></DosarSedinta><DosarSedinta><complet>C2 - civil şi executări (fost minori şi familie)</complet><data>2018-06-19T00:00:00</data><ora>09:00</ora><solutie>Admite cererea</solutie><solutieSumar>Admite cererea de chemare în judecată astfel cum a fost formulată şi precizată.
Admite cererea reconvenţională astfel cum a fost formulată şi precizată.
Declară desfăcută căsătoria încheiată între părţi la data de 10.08.2007 şi trecută în Registrul de stare civilă al Primăriei Sectorului 1 Bucureşti, sub nr. 1037 prin divorţ pe baza acordului părţilor.
Reclamanta-pârâtă va reveni la numele avut anterior încheierii căsătoriei, respectiv acela de Năstase.
Instanţa ia act şi consfinţeşte tranzacţia încheiată între părţi la data de 19.06.2018, după cum urmează:
„Subsemnaţii
BARNOVEANU LIDIA, reclamanta parata, pe de o parte si, parat reclamant, pe de altă parte,
părţi în dosarul nr. 2186/4/2018 aflat pe rolul JUDECĂTORIEI SECTORULUI 4, in vederea încheierii acestui proces, a intervenit prezentul contract de tranzacţie prin care am hotarat urmatoarele:
-Desfacerea căsătoriei incheiate cu parata la data de 10.08.2007 si înregistrata sub nr.1037 in data de 10.08.2007 in registrul de stare civila de pe langa Primaria Sectorul 1 Bucureşti prin acordul pârtilor;
-Revenirea reclamantei-parate la numele purtat anterior căsătoriei si anume NASTASE;
-Exercitarea in comun a autoritatii părinteşti asupra minorei;
-Stabilirea locuinţei minorei la domiciliul reclamantei-parate;
-Stabilirea unui program in favoarea paratului-reclamant in vederea menţinerii legăturii personale cu minora, dupa cum urmeaza:
a)- Sa viziteze minora ori de cate ori va fi necesar sau va solicita aceasta
b)- Sa preia minora doua weekenduri pe luna- primul si al treilea- de vineri dupa terminarea programului şcolar pana duminica seara la orele 19 
-c)- Sa preia minora jumatate din timpul vacantelor şcolare 
-d)- Sărbătorile (Paste, Crăciun, Revelion) sa fie petrecute, prin rotatie, cu fiecare dintre părinţi
Obligarea paratului - reclamant la plata unei pensii de intretinere lunare pentru creşterea si educarea minorei in cuantum de 1/4 din veniturile lunare realizate.
Aceasta înţelegere scrisa, neviciata, reprezintă voinţa libera a pârtilor, act pe care il depunem in instanta in vederea consimţirii lui printr-o hotarare judecătoreasca fara drept de apel.”
Ia act că nu s-au solicitat cheltuieli de judecată.
Dispune înaintarea prezentei hotărâri, după rămânerea definitivă, către Serviciul de Stare Civilă al Primăriei Sectorului 1 Bucureşti pentru efectuarea cuvenitelor menţiuni pe actul de căsătorie.
Definitivă.
Pronunţată în şedinţă publică, astăzi, 19.06.2018.
</solutieSumar><dataPronuntare>2018-06-19T00:00:00</dataPronuntare><documentSedinta>Hotarare</documentSedinta><numarDocument>8097/2018</numarDocument><dataDocument>2018-06-19T00:00:00</dataDocument></DosarSedinta></sedinte><numar>2186/4/2018</numar><numarVechi /><data>2018-01-29T15:36:00</data><institutie>JudecatoriaSECTORUL4BUCURESTI</institutie><departament>....</departament><categorieCaz>Minorisifamilie</categorieCaz><stadiuProcesual>Fond</stadiuProcesual><obiect>divorţ cu copii- îndreptare eroare materială</obiect><dataModificare>2018-09-14T16:50:26.553</dataModificare><categorieCazNume>Minori şi familie</categorieCazNume><stadiuProcesualNume>Fond</stadiuProcesualNume></Dosar><Dosar><parti><DosarParte><nume>Ceparu Petrescu Maria Gabriela</nume><calitateParte>Reclamant</calitateParte></DosarParte><DosarParte><nume>AUTORITATEA TUTELARĂ-PRIMĂRIA SECTOR 4 BUCUREŞTI</nume><calitateParte>Autoritate tutelară</calitateParte></DosarParte><DosarParte><nume>Ceparu Daniel</nume><calitateParte>Pârât</calitateParte></DosarParte></parti><sedinte><DosarSedinta><complet>C15 - civil, minori şi familie</complet><data>2018-09-10T00:00:00</data><ora>09:00</ora><solutie>Admite cererea</solutie><solutieSumar>Admite actiunea principala.
Admite in parte cererea reconventionala.
Desface casatoria incheiata intre parti la data de 27.06.2015 si inregistrata in Registrul de Stare Civila al Primariei Sector 4 Bucuresti sub nr. 780/27.06.2015, din culpa exclusiva a paratului-reclamant.
Dispune exercitarea autoritatii parintesti cu privire la minora CIA, in comun de catre ambele parti.
Stabileste locuinta minorei la domiciliul mamei.
Obliga tatal la plata in favoarea minorei CIA a unei pensii de intretinere in cuantum de 1/6 din veniturile sale nete realizate lunar, incepand cu data introducerii actiunii, respectiv 31.01.2018 si pana la majoratul beneficiarei.
Reclamanta-parata revine la numele purtat anterior casatoriei, respectiv acela de Petrescu.
Incuviinteaza dreptul tatalui de a avea legaturi personale cu minora CIA, dupa urmatorul program de vizita: in al doilea si al patrulea week-end al fiecarei luni, sambata si duminica intre orele 16.00-20.00, in afara domiciliului minorei dar in prezenta mamei minorei sau a unei rude din familia acesteia. 
Compenseaza in totalitate cheltuielile de judecata efectuate de parti.
Cu apel in termen de 30 de zile de la comunicare.
Pronuntata in sedinta publica, azi, 10.09.2018.</solutieSumar><dataPronuntare>2018-09-10T00:00:00</dataPronuntare><documentSedinta>Hotarare</documentSedinta><numarDocument>11216/2018</numarDocument><dataDocument>2018-09-10T00:00:00</dataDocument></DosarSedinta><DosarSedinta><complet>C15 - civil, minori şi familie</complet><data>2018-08-28T00:00:00</data><ora>12:00</ora><solutie>Amână cauza</solutie><solutieSumar>Amana pronuntarea la data de 10.09.2018.
Pronuntata in sedinta publica, azi, 28.08.2018.</solutieSumar><dataPronuntare>2018-08-28T00:00:00</dataPronuntare><documentSedinta>incheiereAmanareinitialaapronuntarii</documentSedinta><numarDocument /><dataDocument>2018-08-28T00:00:00</dataDocument></DosarSedinta><DosarSedinta><complet>C15 - civil, minori şi familie</complet><data>2018-06-05T00:00:00</data><ora>09:00</ora><solutie>Amână cauza</solutie><solutieSumar /><dataPronuntare xsi:nil="true" /><documentSedinta xsi:nil="true" /><numarDocument /><dataDocument xsi:nil="true" /></DosarSedinta></sedinte><caiAtac><DosarCaleAtac><dataDeclarare>2019-01-29T00:00:00</dataDeclarare><parteDeclaratoare> Ceparu Daniel, </parteDeclaratoare><tipCaleAtac>Apel</tipCaleAtac></DosarCaleAtac></caiAtac><numar>2433/4/2018</numar><numarVechi /><data>2018-01-31T15:04:00</data><institutie>JudecatoriaSECTORUL4BUCURESTI</institutie><departament>....</departament><categorieCaz>Minorisifamilie</categorieCaz><stadiuProcesual>Fond</stadiuProcesual><obiect>divorţ cu copii</obiect><dataModificare>2019-02-08T20:50:59.527</dataModificare><categorieCazNume>Minori şi familie</categorieCazNume><stadiuProcesualNume>Fond</stadiuProcesualNume></Dosar><Dosar><parti><DosarParte><nume>Marinescu Bianca Corina</nume><calitateParte>Reclamant</calitateParte></DosarParte><DosarParte><nume>AUTORITATEA TUELARĂ-PRIMĂRIA SECTOR 4 BUCUREŞTI</nume><calitateParte>Autoritate tutelară</calitateParte></DosarParte><DosarParte><nume>Marinescu Ioan Cristian</nume><calitateParte>Pârât</calitateParte></DosarParte></parti><sedinte><DosarSedinta><complet>C15 - civil, minori şi familie</complet><data>2018-11-13T00:00:00</data><ora>09:00</ora><solutie>Admite in parte cererea</solutie><solutieSumar>Admite in parte actiunea principala astfel cum a fost precizata.
Admite cererea reconventionala astfel cum a fost precizata.
Desface casatoria incheiata intre parti la data de 28.06.2014 si inregistrata in Registrul de Stare Civila al Primariei Sector 4 Bucuresti sub nr. 774/28.06.2014, prin acordul sotilor.
Dispune exercitarea autoritatii parintesti cu privire la minora MAM, in comun de catre ambele parti.
Stabileste locuinta minorei la domiciliul tatalui.
Obliga reclamanta-parata la plata unei pensii de intretinere in favoarea minorei MAM, in cuantum de 1/4 din veniturile sale nete realizate lunar, incepand cu data introducerii actiunii, respectiv 01.02.2018 si pana la majoratul beneficiarei.
Reclamanta-parata revine la numele purtat anterior casatoriei, acela de Briscan.
Obliga reclamanta-parata la plata catre paratul-reclamant a sumei de 3.331,38 lei cu titlu de cheltuieli de judecata.
Respinge cererea reclamantei-parate de compensare a cheltuielilor de judecata, ca neintemeiata.
Definitiva in ceea ce priveste capetele de cerere avand ca obiect desfacerea casatoriei, numele sotilor dupa divort si exercitarea autoritatii parintesti. 
Cu apel in termen de 30 de zile de la comunicare in ceea ce priveste capetele de cerere avand ca obiect locuinta minorei si pensia de intretinere.
Pronuntata in sedinta publica, azi, 13.11.2018.</solutieSumar><dataPronuntare>2018-11-13T00:00:00</dataPronuntare><documentSedinta>Hotarare</documentSedinta><numarDocument>14493/2018</numarDocument><dataDocument>2018-11-13T00:00:00</dataDocument></DosarSedinta><DosarSedinta><complet>C15 - civil, minori şi familie</complet><data>2018-11-05T00:00:00</data><ora>09:00</ora><solutie>Amână pronunţarea</solutie><solutieSumar>Amana pronuntarea la data de 13.11.2018. Pronuntata in sedinta publica, azi, 05.11.2018.</solutieSumar><dataPronuntare>2018-11-05T00:00:00</dataPronuntare><documentSedinta>incheiereAmanareulterioaraapronuntarii</documentSedinta><numarDocument /><dataDocument>2018-11-05T00:00:00</dataDocument></DosarSedinta><DosarSedinta><complet>C15 - civil, minori şi familie</complet><data>2018-10-22T00:00:00</data><ora>09:00</ora><solutie>Amână pronunţarea</solutie><solutieSumar>Amana pronuntarea la data de 05.11.2018.
Pronuntata in sedinta publica, azi, 22.10.2018.</solutieSumar><dataPronuntare>2018-10-22T00:00:00</dataPronuntare><documentSedinta>incheiereAmanareinitialaapronuntarii</documentSedinta><numarDocument /><dataDocument>2018-10-22T00:00:00</dataDocument></DosarSedinta><DosarSedinta><complet>C15 - civil, minori şi familie</complet><data>2018-10-01T00:00:00</data><ora>09:00</ora><solutie>Amână cauza</solutie><solutieSumar /><dataPronuntare xsi:nil="true" /><documentSedinta xsi:nil="true" /><numarDocument /><dataDocument xsi:nil="true" /></DosarSedinta><DosarSedinta><complet>C15 - civil, minori şi familie</complet><data>2018-08-28T00:00:00</data><ora>09:00</ora><solutie>Amână cauza</solutie><solutieSumar /><dataPronuntare xsi:nil="true" /><documentSedinta xsi:nil="true" /><numarDocument /><dataDocument xsi:nil="true" /></DosarSedinta><DosarSedinta><complet>C15 - civil, minori şi familie</complet><data>2018-06-05T00:00:00</data><ora>09:00</ora><solutie>Amână cauza</solutie><solutieSumar /><dataPronuntare xsi:nil="true" /><documentSedinta xsi:nil="true" /><numarDocument /><dataDocument xsi:nil="true" /></DosarSedinta></sedinte><caiAtac><DosarCaleAtac><dataDeclarare>2019-03-27T00:00:00</dataDeclarare><parteDeclaratoare> Marinescu Bianca Corina, </parteDeclaratoare><tipCaleAtac>Apel</tipCaleAtac></DosarCaleAtac></caiAtac><numar>2507/4/2018</numar><numarVechi /><data>2018-02-01T11:26:00</data><institutie>JudecatoriaSECTORUL4BUCURESTI</institutie><departament>....</departament><categorieCaz>Minorisifamilie</categorieCaz><stadiuProcesual>Fond</stadiuProcesual><obiect>divorţ cu copii</obiect><dataModificare>2019-04-24T16:02:08.523</dataModificare><categorieCazNume>Minori şi familie</categorieCazNume><stadiuProcesualNume>Fond</stadiuProcesualNume></Dosar><Dosar><parti><DosarParte><nume>Filimon Adi Daniel</nume><calitateParte>Reclamant</calitateParte></DosarParte><DosarParte><nume>AUTORITATEA TUTELARĂ-PRIMĂRIA SECTOR 4 BUCUREŞTI</nume><calitateParte>Autoritate tutelară</calitateParte></DosarParte><DosarParte><nume>Filimon Giorgiana</nume><calitateParte>Pârât</calitateParte></DosarParte></parti><sedinte><DosarSedinta><complet>C2 - civil şi executări (fost minori şi familie)</complet><data>2018-10-03T00:00:00</data><ora>09:00</ora><solutie>Admite in parte cererea</solutie><solutieSumar>Admite în parte cererea de chemare în judecată astfel cum a fost precizată.
Admite în parte cererea reconvenţională astfel cum a fost precizată.
Declară desfăcută căsătoria încheiată între părţi la data de 27.08.2016 şi trecută în Registrul de Stare Civilă al Primăriei Sectorului 4 Bucureşti sub nr. 1531 prin divorţ pe baza acordului soţilor.
Pârâta-reclamantă reconvenţională va reveni la numele avut anterior încheierii căsătoriei, respectiv acela de Dobra.
Dispune înaintarea prezentei hotărâri, după rămânerea definitivă, către Serviciul de Stare Civilă al Primăriei Sectorului 4 Bucureşti pentru efectuarea cuvenitelor menţiuni pe actul de căsătorie.
Dispune exercitarea autorităţii părinteşti cu privire la minora, în comun de către ambii părinţi.
Stabileşte locuinţa minorei, la mamă.
Obligă reclamantul-pârât reconvenţional să plătească în favoarea minorei, o pensie lunară de întreţinere în cuantum de 1/4 din veniturile nete lunare realizate de către tată, începând cu data introducerii cererii de chemare în judecată, respectiv  02.02.2018, ?i până la majoratul beneficiarei.
Încuviinţează reclamantului-pârât reconvenţional să aibă legături personale cu minora, după următorul program:    
a)- până la împlinirea vârstei de 2 ani, fără prezenţa mamei şi cu posibilitatea de a lua minora de la domiciliul mamei şi cu obligaţia de a o readuce la locuinţă : în prima şi a treia săptămână din fiecare lună, în ziua de joi între orele 16:00-20:00, iar în ziua de vineri între orele 10:00-14:00; în al doilea şi al patrulea sfârşit de săptămână din fiecare lună, sâmbăta şi duminica, între orele 10:00-20:00; 
b)- după împlinirea vârstei de 2 ani, fără prezenţa mamei şi cu posibilitatea de a lua minora de la domiciliul mamei şi cu obligaţia de a o readuce la locuinţă: în prima şi a treia săptămână din fiecare lună, în ziua de joi între orele 16:00-20:00; în al doilea şi al patrulea sfârşit de săptămână din fiecare lună, începând de vineri orele 16:00 şi până duminică orele 20:00. 
		Respinge în rest cererea de chemare în judecată, ca neîntemeiată.
		Respinge în rest cererea reconvenţională, ca neîntemeiată.
Ia act că nu s-au solicitat cheltuieli de judecată.
Executorie de drept cu privire la modul de exercitare a autorităţii părinteşti, stabilirea locuinţei minorei, obligaţia de întreţinere a copilului şi dreptul de a avea legături personale cu minora.
Definitivă în ceea ce priveşte desfacerea căsătoriei şi cu drept de apel în termen de 30 de zile de la comunicare pentru celelalte capete de cerere, cererea urmând a fi depusă la Judecătoria Sectorului 4 Bucureşti.
 Soluţie pusă la dispoziţia părţilor prin mijlocirea grefei instanţei, conform art. 396 alin. 2 din Codul de procedură civilă, astăzi, 03.10.2018.
		 
                                                              	  
</solutieSumar><dataPronuntare>2018-10-03T00:00:00</dataPronuntare><documentSedinta>Hotarare</documentSedinta><numarDocument>12333/2018</numarDocument><dataDocument>2018-10-03T00:00:00</dataDocument></DosarSedinta><DosarSedinta><complet>C2 - civil şi executări (fost minori şi familie)</complet><data>2018-09-18T00:00:00</data><ora>09:00</ora><solutie>Amână pronunţarea</solutie><solutieSumar>Amână pronunţarea la data de 03.10.2018.
            Pronunţată în şedinţă publică, astăzi, la data de 18.09.2018.
</solutieSumar><dataPronuntare xsi:nil="true" /><documentSedinta>incheiereAmanareulterioaraapronuntarii</documentSedinta><numarDocument /><dataDocument>2018-09-18T00:00:00</dataDocument></DosarSedinta><DosarSedinta><complet>C2 - civil şi executări (fost minori şi familie)</complet><data>2018-09-03T00:00:00</data><ora>11:00</ora><solutie>Amână pronunţarea</solutie><solutieSumar>Amână pronunţarea la data de 18.09.2018.
            Pronunţată în şedinţă publică, astăzi, la data de 03.09.2018.
</solutieSumar><dataPronuntare xsi:nil="true" /><documentSedinta>incheiereAmanareinitialaapronuntarii</documentSedinta><numarDocument /><dataDocument>2018-09-03T00:00:00</dataDocument></DosarSedinta><DosarSedinta><complet>C2 - civil şi executări (fost minori şi familie)</complet><data>2018-05-22T00:00:00</data><ora>09:00</ora><solutie>Amână cauza</solutie><solutieSumar /><dataPronuntare xsi:nil="true" /><documentSedinta>incheieredesedinta</documentSedinta><numarDocument /><dataDocument>2018-05-22T00:00:00</dataDocument></DosarSedinta></sedinte><caiAtac><DosarCaleAtac><dataDeclarare>2018-12-11T00:00:00</dataDeclarare><parteDeclaratoare> Filimon Giorgiana, </parteDeclaratoare><tipCaleAtac>Apel</tipCaleAtac></DosarCaleAtac><DosarCaleAtac><dataDeclarare>2018-12-10T00:00:00</dataDeclarare><parteDeclaratoare> Filimon Giorgiana, </parteDeclaratoare><tipCaleAtac>Apel</tipCaleAtac></DosarCaleAtac></caiAtac><numar>2609/4/2018</numar><numarVechi /><data>2018-02-02T10:28:00</data><institutie>JudecatoriaSECTORUL4BUCURESTI</institutie><departament>....</departament><categorieCaz>Minorisifamilie</categorieCaz><stadiuProcesual>Fond</stadiuProcesual><obiect>divorţ cu copii</obiect><dataModificare>2019-01-11T15:27:08.427</dataModificare><categorieCazNume>Minori şi familie</categorieCazNume><stadiuProcesualNume>Fond</stadiuProcesualNume></Dosar><Dosar><parti><DosarParte><nume>Andrei Elisabeta</nume><calitateParte>Reclamant</calitateParte></DosarParte><DosarParte><nume>AUTORITATEA TUTELARĂ-PRIMĂRIA SECTOR 4 BUCUREŞTI</nume><calitateParte>Autoritate tutelară</calitateParte></DosarParte><DosarParte><nume>Andrei Florin</nume><calitateParte>Pârât</calitateParte></DosarParte></parti><sedinte><DosarSedinta><complet>C13 - civil, minori şi familie</complet><data>2018-06-05T00:00:00</data><ora>08:30</ora><solutie>Admite in parte cererea</solutie><solutieSumar>Admite in parte acţiunea formulată de reclamanta Andrei Elisabeta, în contradictoriu cu pârâtul  Andrei Florin, si
Admite in parte cererea reconven?ionala formulata de pârâtul reclamant in contradictoriu cu reclamanta parata in consecin?a :
Desface căsătoria încheiată de părţi .
Reclamanta va purta numele de Andrei.
Stabile?te că autoritatea părintească asupra minorului să fie exercitată exclusiv de tata.
Stabileşte locuinţa minorului la locuinţa tatălui.
Obliga mama la plata unei pensii de între?inere in favoarea fiicei minore in cuantum de 1/4 din venitul minim pe economie începând cu data pronun?ării prezentei hotărâri si pana la majorat sub rezerva modificării in condi?iile legii.
Fără cheltuieli de judecata.
Cu drept de apel în termen de 30 de zile de la comunicare.
	Pronunţată în şedinţa publică din data de 05.06.2018.
</solutieSumar><dataPronuntare>2018-06-05T00:00:00</dataPronuntare><documentSedinta>Hotarare</documentSedinta><numarDocument>7420/2018</numarDocument><dataDocument>2018-06-05T00:00:00</dataDocument></DosarSedinta><DosarSedinta><complet>C13 - civil, minori şi familie</complet><data>2018-05-08T00:00:00</data><ora>08:30</ora><solutie>Amână cauza</solutie><solutieSumar /><dataPronuntare xsi:nil="true" /><documentSedinta xsi:nil="true" /><numarDocument /><dataDocument xsi:nil="true" /></DosarSedinta></sedinte><caiAtac><DosarCaleAtac><dataDeclarare>2018-08-28T00:00:00</dataDeclarare><parteDeclaratoare> Andrei Elisabeta, </parteDeclaratoare><tipCaleAtac>Apel</tipCaleAtac></DosarCaleAtac></caiAtac><numar>3287/4/2018</numar><numarVechi /><data>2018-02-09T11:17:00</data><institutie>JudecatoriaSECTORUL4BUCURESTI</institutie><departament>....</departament><categorieCaz>Minorisifamilie</categorieCaz><stadiuProcesual>Fond</stadiuProcesual><obiect>divorţ cu copii</obiect><dataModificare>2018-09-05T17:48:10.35</dataModificare><categorieCazNume>Minori şi familie</categorieCazNume><stadiuProcesualNume>Fond</stadiuProcesualNume></Dosar><Dosar><parti><DosarParte><nume>Buşoi Patriţa</nume><calitateParte>Reclamant</calitateParte></DosarParte><DosarParte><nume>Buşoi Lucian Ioan</nume><calitateParte>Pârât</calitateParte></DosarParte></parti><sedinte><DosarSedinta><complet>C19 - civil, minori şi familie</complet><data>2018-11-27T00:00:00</data><ora>09:00</ora><solutie>Admite in parte cererea</solutie><solutieSumar>Admite în parte cererea principală de chemare în judecată.
Admite în parte cererea reconven?ională.
Declară desfăcută din culpa comună a soţilor căsătoria.
Reclamanta va relua numele purtat anterior încheierii căsătoriei.Respinge cererea de obligare a reclamantei la plata unor despăgubiri ca urmare a desfacerii căsătoriei.
Compensează în totalitate cheltuielile de judecată.
La rămânerea definitivă, prezenta hotărâre se va comunica, din oficiu, Primăriei Sector 4 Bucureşti pentru efectuarea cuvenitelor menţiuni pe actul de căsătorie.
Cu drept de apel în termen de 30 de zile de la comunicare, cererea urmând a fi depusă la Judecătoria Sectorului 4 Bucureşti.
Soluţie pusă la dispoziţia părţilor prin mijlocirea grefei instanţei, conform art. 396 alin. 2 din Codul de procedură civilă, astăzi, 27.11.2018.
</solutieSumar><dataPronuntare>2018-11-27T00:00:00</dataPronuntare><documentSedinta>Hotarare</documentSedinta><numarDocument>15116/2018</numarDocument><dataDocument>2018-11-27T00:00:00</dataDocument></DosarSedinta><DosarSedinta><complet>C19 - civil, minori şi familie</complet><data>2018-11-13T00:00:00</data><ora>09:00</ora><solutie>Amână pronunţarea</solutie><solutieSumar>

Având nevoie de timp pentru a delibera, amână pronunţarea la data de 27.11.2018.
Pronunţată în şedinţă publică azi, 13.11.2018.
</solutieSumar><dataPronuntare xsi:nil="true" /><documentSedinta>incheiereAmanareinitialaapronuntarii</documentSedinta><numarDocument /><dataDocument>2018-11-13T00:00:00</dataDocument></DosarSedinta><DosarSedinta><complet>C19 - civil, minori şi familie</complet><data>2018-09-11T00:00:00</data><ora>09:00</ora><solutie>Amână cauza</solutie><solutieSumar /><dataPronuntare xsi:nil="true" /><documentSedinta xsi:nil="true" /><numarDocument /><dataDocument xsi:nil="true" /></DosarSedinta><DosarSedinta><complet>C19 - civil, minori şi familie</complet><data>2018-06-28T00:00:00</data><ora>09:00</ora><solutie>Amână cauza</solutie><solutieSumar /><dataPronuntare xsi:nil="true" /><documentSedinta xsi:nil="true" /><numarDocument /><dataDocument xsi:nil="true" /></DosarSedinta></sedinte><numar>3519/4/2018</numar><numarVechi /><data>2018-02-13T09:51:00</data><institutie>JudecatoriaSECTORUL4BUCURESTI</institutie><departament>....</departament><categorieCaz>Minorisifamilie</categorieCaz><stadiuProcesual>Fond</stadiuProcesual><obiect>divorţ fara copii</obiect><dataModificare>2019-02-15T15:33:35.16</dataModificare><categorieCazNume>Minori şi familie</categorieCazNume><stadiuProcesualNume>Fond</stadiuProcesualNume></Dosar><Dosar><parti><DosarParte><nume>Chircu Lucian</nume><calitateParte>Reclamant</calitateParte></DosarParte><DosarParte><nume>AUTORITATEA TUTELARĂ-PRIMĂRIA SECTOR 4 BUCUREŞTI</nume><calitateParte>Autoritate tutelară</calitateParte></DosarParte><DosarParte><nume>Chircu Caterina Mariana</nume><calitateParte>Pârât</calitateParte></DosarParte><DosarParte><nume>Chircu Caterina Mariana prin curator special Galita Mirab</nume><calitateParte>Pârât</calitateParte></DosarParte></parti><sedinte><DosarSedinta><complet>C19 - civil, minori şi familie</complet><data>2018-09-25T00:00:00</data><ora>09:00</ora><solutie>Admite cererea</solutie><solutieSumar>Admite cererea de chemare în judecată precizată.
Declară desfăcută căsătoria încheiată între părţi  din culpa exclusivă a pârâtei.
 Pârâta va reveni la numele purtat anterior încheierii căsătoriei. Autoritatea părintească cu privire la minoră  va fi exercitată exclusiv de către tată.
Stabileşte locuinţa minorei la domiciliul tatălui din Bucureşti,  sector 4 .
Obligă pârâta să plătească în favoarea minorei o pensie de întreţinere lunară în cotă de 1/4 din venitul minim net lunar pe economia naţională, începând cu data introducerii cererii de chemare în judecată, respectiv 15.02.2018 şi până la majoratul beneficiarei. 
Ia act că reclamantul nu a solicitat cheltuieli de judecată.
Dispune înaintarea prezentei hotărâri, după rămânerea definitivă, către Serviciul de Stare Civilă al Primăriei Sectorului 1 Bucureşti pentru efectuarea cuvenitelor menţiuni pe actul de căsătorie.
Cu drept de apel în termen de 30 de zile de la comunicare, cererea urmând a fi depusă la Judecătoria Sectorului 4 Bucureşti.
Soluţie pusă la dispoziţia părţilor prin mijlocirea grefei instanţei, conform art. 396 alin. 2 din Codul de procedură civilă, astăzi, 25.09.2018.
</solutieSumar><dataPronuntare>2018-09-25T00:00:00</dataPronuntare><documentSedinta>Hotarare</documentSedinta><numarDocument>11723/2018</numarDocument><dataDocument>2018-09-25T00:00:00</dataDocument></DosarSedinta><DosarSedinta><complet>C19 - civil, minori şi familie</complet><data>2018-09-11T00:00:00</data><ora>09:00</ora><solutie>Amână pronunţarea</solutie><solutieSumar>Având nevoie de timp pentru a delibera, amână pronunţarea la data de 25.09.2018.
Pronunţată în şedinţă publică azi, 11.09.2018.
</solutieSumar><dataPronuntare xsi:nil="true" /><documentSedinta>incheiereAmanareinitialaapronuntarii</documentSedinta><numarDocument /><dataDocument>2018-09-11T00:00:00</dataDocument></DosarSedinta><DosarSedinta><complet>C19 - civil, minori şi familie</complet><data>2018-06-07T00:00:00</data><ora>09:00</ora><solutie>Amână cauza</solutie><solutieSumar /><dataPronuntare xsi:nil="true" /><documentSedinta xsi:nil="true" /><numarDocument /><dataDocument xsi:nil="true" /></DosarSedinta></sedinte><numar>3795/4/2018</numar><numarVechi /><data>2018-02-15T11:35:00</data><institutie>JudecatoriaSECTORUL4BUCURESTI</institutie><departament>....</departament><categorieCaz>Minorisifamilie</categorieCaz><stadiuProcesual>Fond</stadiuProcesual><obiect>divorţ cu copii</obiect><dataModificare>2018-11-07T17:46:42.893</dataModificare><categorieCazNume>Minori şi familie</categorieCazNume><stadiuProcesualNume>Fond</stadiuProcesualNume></Dosar><Dosar><parti><DosarParte><nume>Stanel Laura Andreea</nume><calitateParte>Reclamant</calitateParte></DosarParte><DosarParte><nume>Singh Baljinder</nume><calitateParte>Pârât</calitateParte></DosarParte><DosarParte><nume>Moţoc Gabriela -curator pt.pârâtul Singh Baljinder</nume><calitateParte>Curator</calitateParte></DosarParte></parti><sedinte><DosarSedinta><complet>C23 - civil, minori şi familie</complet><data>2018-09-27T00:00:00</data><ora>09:00</ora><solutie>Admite cererea</solutie><solutieSumar>Admite cererea. 
	Declară desfăcută căsătoria încheiată între părţi la data de 12.03.2015 şi trecută în Registrul de Stare Civilă al Primăriei Adunaţii - Copăceni sub nr. 3 prin divorţ din culpa exclusivă a soţiei reclamante.
	Ia act că părţile nu şi-au schimbat numele în urma încheierii căsătoriei.
	Dispune înaintarea prezentei hotărâri, după rămânerea definitivă, către Serviciul de Stare Civilă al Primăriei Adunaţii - Copăceni  pentru efectuarea cuvenitelor menţiuni pe actul de căsătorie.
	Cu drept de apel în termen de 30 de zile de la comunicare, cererea urmând a fi depusă la Judecătoria Sectorului 4 Bucureşti.
	Pronunţată în şedinţă publică, astăzi, 27.09.2018.
</solutieSumar><dataPronuntare>2018-09-27T00:00:00</dataPronuntare><documentSedinta>Hotarare</documentSedinta><numarDocument>11998/2018</numarDocument><dataDocument>2018-09-27T00:00:00</dataDocument></DosarSedinta><DosarSedinta><complet>C23 - civil, minori şi familie</complet><data>2018-09-20T00:00:00</data><ora>09:00</ora><solutie>Amână cauza</solutie><solutieSumar>Amână pronunţarea la data de 27.09.2018. Pronunţată în şedinţă publică azi, 20.09.2018. </solutieSumar><dataPronuntare xsi:nil="true" /><documentSedinta>incheiereAmanareulterioaraapronuntarii</documentSedinta><numarDocument /><dataDocument>2018-09-20T00:00:00</dataDocument></DosarSedinta><DosarSedinta><complet>C23 - civil, minori şi familie</complet><data>2018-09-13T00:00:00</data><ora>09:00</ora><solutie>Amână cauza</solutie><solutieSumar>  Amână pronunţarea la data de 20.09.2018 
              Pronunţată în şedinţă publică, azi 13.09.2018. 
</solutieSumar><dataPronuntare xsi:nil="true" /><documentSedinta>incheiereAmanareinitialaapronuntarii</documentSedinta><numarDocument /><dataDocument>2018-09-13T00:00:00</dataDocument></DosarSedinta><DosarSedinta><complet>C23 - civil, minori şi familie</complet><data>2018-06-08T00:00:00</data><ora>09:00</ora><solutie>Amână cauza</solutie><solutieSumar /><dataPronuntare xsi:nil="true" /><documentSedinta xsi:nil="true" /><numarDocument /><dataDocument xsi:nil="true" /></DosarSedinta><DosarSedinta><complet>C23 - civil, minori şi familie</complet><data>2018-04-20T00:00:00</data><ora>09:00</ora><solutie>Amână cauza</solutie><solutieSumar /><dataPronuntare xsi:nil="true" /><documentSedinta xsi:nil="true" /><numarDocument /><dataDocument xsi:nil="true" /></DosarSedinta></sedinte><numar>3997/4/2018</numar><numarVechi /><data>2018-02-16T00:00:00</data><institutie>JudecatoriaSECTORUL4BUCURESTI</institutie><departament>....</departament><categorieCaz>Minorisifamilie</categorieCaz><stadiuProcesual>Fond</stadiuProcesual><obiect>divorţ fara copii</obiect><dataModificare>2018-10-21T19:33:15.503</dataModificare><categorieCazNume>Minori şi familie</categorieCazNume><stadiuProcesualNume>Fond</stadiuProcesualNume></Dosar><Dosar><parti><DosarParte><nume>Boangiu Larisa</nume><calitateParte>Reclamant</calitateParte></DosarParte><DosarParte><nume>Boangiu Marian</nume><calitateParte>Pârât</calitateParte></DosarParte></parti><sedinte><DosarSedinta><complet>C23 - civil, minori şi familie</complet><data>2018-11-08T00:00:00</data><ora>09:00</ora><solutie>Admite cererea</solutie><solutieSumar>Admite cererea.
	Dispune desfacerea căsătoriei încheiată sub nr.2/24.01.1998 la Primăria Tetoiu, judeţul Vâlcea,  din culpa comună.
Dispune revenirea reclamantei la numele avut anterior încheierii căsătoriei, respectiv “Mocanu”. 
	Ia act că nu au fost solicitate cheltuieli de judecată.
Cu apel în 30 de zile de la comunicare. Cererea de apel se depune la Judecătoria Sector 4 Bucureşti.
Pronunţată în şedinţă publică, azi 08.11.2018. 
</solutieSumar><dataPronuntare>2018-11-08T00:00:00</dataPronuntare><documentSedinta>Hotarare</documentSedinta><numarDocument>14207/2018</numarDocument><dataDocument>2018-11-08T00:00:00</dataDocument></DosarSedinta><DosarSedinta><complet>C23 - civil, minori şi familie</complet><data>2018-10-25T00:00:00</data><ora>12:00</ora><solutie>Amână cauza</solutie><solutieSumar>Amână pronunţarea la data de 08.11.2018. 
	Pronunţată în şedinţă publică, azi 25.10.2018. 
</solutieSumar><dataPronuntare>2018-10-25T00:00:00</dataPronuntare><documentSedinta>incheiereAmanareinitialaapronuntarii</documentSedinta><numarDocument /><dataDocument>2018-10-25T00:00:00</dataDocument></DosarSedinta><DosarSedinta><complet>C23 - civil, minori şi familie</complet><data>2018-09-13T00:00:00</data><ora>09:00</ora><solutie>Amână cauza</solutie><solutieSumar /><dataPronuntare xsi:nil="true" /><documentSedinta>incheieredesedinta</documentSedinta><numarDocument /><dataDocument>2018-09-13T00:00:00</dataDocument></DosarSedinta><DosarSedinta><complet>C23 - civil, minori şi familie</complet><data>2018-06-08T00:00:00</data><ora>09:00</ora><solutie>Amână cauza</solutie><solutieSumar /><dataPronuntare xsi:nil="true" /><documentSedinta xsi:nil="true" /><numarDocument /><dataDocument xsi:nil="true" /></DosarSedinta></sedinte><numar>4009/4/2018</numar><numarVechi /><data>2018-02-19T09:48:00</data><institutie>JudecatoriaSECTORUL4BUCURESTI</institutie><departament>....</departament><categorieCaz>Minorisifamilie</categorieCaz><stadiuProcesual>Fond</stadiuProcesual><obiect>divorţ fara copii</obiect><dataModificare>2018-11-16T17:14:29.137</dataModificare><categorieCazNume>Minori şi familie</categorieCazNume><stadiuProcesualNume>Fond</stadiuProcesualNume></Dosar><Dosar><parti><DosarParte><nume>Tornea Mirela</nume><calitateParte>Reclamant</calitateParte></DosarParte><DosarParte><nume>AUTORITATEA TUTELARĂ-PRIMĂRIA SECTOR 4 BUCUREŞTI</nume><calitateParte>Autoritate tutelară</calitateParte></DosarParte><DosarParte><nume>Tornea Ionuţ Cosmin</nume><calitateParte>Pârât</calitateParte></DosarParte></parti><sedinte><DosarSedinta><complet>C2 - civil şi executări (fost minori şi familie)</complet><data>2019-03-05T00:00:00</data><ora>09:00</ora><solutie>Încheiere</solutie><solutieSumar>Respinge cererea privind îndreptarea erorii materiale formulată de către pârâtul Tornea Ionuţ Cosmin, ca neîntemeiată.
Cu drept de apel în termen de 30 de zile de la comunicare, cererea urmând a fi depusă la Judecătoria Sectorului 4 Bucureşti.
Soluţie pusă la dispoziţia părţilor prin mijlocirea grefei instanţei, conform art. 396 alin. 2 din C.proc.civ., astăzi, 05.03.2019.
	
</solutieSumar><dataPronuntare>2019-03-05T00:00:00</dataPronuntare><documentSedinta>incheieredesedinta</documentSedinta><numarDocument /><dataDocument>2019-03-05T00:00:00</dataDocument></DosarSedinta><DosarSedinta><complet>C2 - civil şi executări (fost minori şi familie)</complet><data>2019-02-18T00:00:00</data><ora>09:00</ora><solutie>Amână pronunţarea</solutie><solutieSumar>Având nevoie de timp pentru a delibera, amână pronunţarea la data de 05.03.2019.
Pronunţată în şedinţă publică azi, 18.02.2019.
</solutieSumar><dataPronuntare xsi:nil="true" /><documentSedinta>incheiereAmanareinitialaapronuntarii</documentSedinta><numarDocument /><dataDocument>2019-02-18T00:00:00</dataDocument></DosarSedinta><DosarSedinta><complet>C2 - civil şi executări (fost minori şi familie)</complet><data>2018-11-20T00:00:00</data><ora>09:00</ora><solutie>Admite in parte cererea</solutie><solutieSumar>Admite în parte cererea de chemare în judecată.
Declară desfăcută căsătoria încheiată între părţi la data de 15.02.2015 şi trecută în Registrul de Stare Civilă al Primăriei Sectorului 4 Bucureşti  sub nr. 119, prin divorţ din culpa comună a soţilor.
Reclamanta va reveni la numele avut anterior încheierii căsătoriei, respectiv acela de Zurini.
Dispune înaintarea prezentei hotărâri, după rămânerea definitivă, către Serviciul de Stare Civilă al Primăriei Sectorului 4 Bucureşti pentru efectuarea cuvenitelor menţiuni pe actul de căsătorie.
Dispune exercitarea autorităţii părinteşti cu privire la minora, în comun de către ambii părinţi.
Stabileşte locuinţa minorei, la mamă.
Obligă pârâtul să plătească în favoarea minorei, o pensie lunară de întreţinere în cuantum de 1/4 din venitul net lunar realizat de pârât, dar nu mai puţin de 1/4 din venitul minim net pe economia naţională, începând cu data introducerii cererii de chemare în judecată, respectiv 19.02.2018, şi până la majoratul beneficiarei. 
Încuviinţează pârâtului să aibă legături personale cu minora, după următorul program:    
- în primul şi al treilea sfârşit de săptămână din lună, de vineri, orele 18:00, până duminică, orele 18:00, cu luarea minorei la domiciliul tatălui şi cu obligarea acestuia de a o readuce la domiciliu la sfârşitul programului de vizitare;
- în săptămânile pare, în ziua de joi, tatăl va putea prelua minora după terminarea cursurilor şcolare/activităţilor extraşcolare şi o va readuce la domiciliu la orele 20:00;
- în anii impari, în zilele libere cu ocazia Sărbătorii Crăciunului, respectiv 25-26 decembrie, iar în anii pari, în zilele libere cu ocazia Sărbătorii Paştilor, respectiv prima, a doua zi şi a treia zi de Paşti şi în zilele libere cu ocazia sărbătoririi Revelionului, respectiv 31 decembrie-2 ianuarie, cu luarea minorei la domiciliul tatălui şi cu obligarea acestuia de a o readuce la domiciliu la sfârşitul programului de vizitare;
- o lună în vacanţa de vară, în anii impari, luna iulie (01-31 iulie), iar în anii pari, luna august (01-31 august), cu luarea minorei la domiciliul tatălui şi cu obligarea acestuia de a o readuce la domiciliu la sfârşitul programului de vizitare.
		Respinge în rest cererea de chemare în judecată, ca neîntemeiată.		
Obligă pârâtul la plata către reclamantă a sumei de 600 lei cu titlu cheltuieli de judecată, din care suma de 100 lei reprezintă taxă judiciară de timbru, iar suma de 500 lei reprezintă onorariu de avocat.
Cu drept de apel în termen de 30 de zile de la comunicare, cererea urmând a fi depusă la Judecătoria Sectorului 4 Bucureşti.
 Soluţie pusă la dispoziţia părţilor prin mijlocirea grefei instanţei, conform art. 396 alin. 2 din Codul de procedură civilă, astăzi, 20.11.2018.
	
</solutieSumar><dataPronuntare>2018-11-20T00:00:00</dataPronuntare><documentSedinta>Hotarare</documentSedinta><numarDocument>14830/2018</numarDocument><dataDocument>2018-11-20T00:00:00</dataDocument></DosarSedinta><DosarSedinta><complet>C2 - civil şi executări (fost minori şi familie)</complet><data>2018-11-05T00:00:00</data><ora>11:00</ora><solutie>Amână pronunţarea</solutie><solutieSumar>Amână pronunţarea la data de 20.11.2018.
            Pronunţată în şedinţă publică, astăzi, la data de 05.11.2018.

</solutieSumar><dataPronuntare xsi:nil="true" /><documentSedinta>incheiereAmanareinitialaapronuntarii</documentSedinta><numarDocument /><dataDocument>2018-11-05T00:00:00</dataDocument></DosarSedinta><DosarSedinta><complet>C2 - civil şi executări (fost minori şi familie)</complet><data>2018-09-24T00:00:00</data><ora>09:00</ora><solutie>Amână cauza</solutie><solutieSumar /><dataPronuntare xsi:nil="true" /><documentSedinta>incheieredesedinta</documentSedinta><numarDocument /><dataDocument>2018-09-24T00:00:00</dataDocument></DosarSedinta><DosarSedinta><complet>C2 - civil şi executări (fost minori şi familie)</complet><data>2018-06-19T00:00:00</data><ora>09:00</ora><solutie>Amână cauza</solutie><solutieSumar /><dataPronuntare xsi:nil="true" /><documentSedinta>incheieredesedinta</documentSedinta><numarDocument /><dataDocument>2018-06-19T00:00:00</dataDocument></DosarSedinta><DosarSedinta><complet>C2 - civil şi executări (fost minori şi familie)</complet><data>2018-05-22T00:00:00</data><ora>09:00</ora><solutie>Amână cauza</solutie><solutieSumar /><dataPronuntare xsi:nil="true" /><documentSedinta>incheieredesedinta</documentSedinta><numarDocument /><dataDocument>2018-05-22T00:00:00</dataDocument></DosarSedinta><DosarSedinta><complet>C19 - civil, minori şi familie</complet><data>2018-02-26T00:00:00</data><ora>09:00</ora><solutie>Amână cauza</solutie><solutieSumar>În temeiul art. 107 alin. 1 şi 3 din Regulamentul de ordine interioară al instanţelor judecătoreşti aprobat prin Hotărârea Consiliului Superior al Magistraturii nr. 1375/2015,dispune înaintarea prezentului dosar către completul C2 - civil, minori şi familie, ce a fost învestit iniţial cu soluţionarea dosarului nr. 489/4/2018.</solutieSumar><dataPronuntare>2018-02-26T00:00:00</dataPronuntare><documentSedinta>Rezolutietrimiterecompletinitial</documentSedinta><numarDocument /><dataDocument>2018-02-26T00:00:00</dataDocument></DosarSedinta></sedinte><numar>4069/4/2018</numar><numarVechi /><data>2018-02-19T11:46:00</data><institutie>JudecatoriaSECTORUL4BUCURESTI</institutie><departament>....</departament><categorieCaz>Minorisifamilie</categorieCaz><stadiuProcesual>Fond</stadiuProcesual><obiect>divorţ cu copii</obiect><dataModificare>2020-10-02T12:20:37.55</dataModificare><categorieCazNume>Minori şi familie</categorieCazNume><stadiuProcesualNume>Fond</stadiuProcesualNume></Dosar><Dosar><parti><DosarParte><nume>Dragomir Mariana</nume><calitateParte>Reclamant</calitateParte></DosarParte><DosarParte><nume>AUTORITATEA TUTELARĂ-PRIMĂRIA SECTOR 4 BUCUREŞTI</nume><calitateParte>Autoritate tutelară</calitateParte></DosarParte><DosarParte><nume>Dragomir Ionel</nume><calitateParte>Pârât</calitateParte></DosarParte></parti><sedinte><DosarSedinta><complet>C15 - civil, minori şi familie</complet><data>2018-08-28T00:00:00</data><ora>09:00</ora><solutie>Admite cererea</solutie><solutieSumar>Admite actiunea astfel cum a fost precizata.
Desface casatoria incheiata intre parti la data de 30.07.2005si inregistrata in Registrul de Stare Civila al Primariei Sector 4 Bucuresti sub nr. 1078/30.07.2005, din culpa exclusiva a paratului.
Dispune exercitarea autoritatii aprintesti cu privire la minorul DMT, exclusiv de catre mama
Stabileste locuinta minorului DMT la domiciliul mamei.
Obliga paratul la plata unei pensii de intretinere in favoarea minorului DMT in cuantum de 1/4 din veniturile nete realizate lunar, incepand cu data iontroducerii actiunii, respectiv 21.02.2018 si pana la majoratul beneficiarului.
Parata revine la numele purtat anterior casatoriei, acela de Dumitru.
Obliga paratul la plata catre reclamanta a sumei de 1.600 lei cu titlu de cheltuieli de judecata.
Cu pel in termen de 30 de zile de la comunicare..
Pronuntata in sedinta publica, azi, 28.08.2018.</solutieSumar><dataPronuntare>2018-08-28T00:00:00</dataPronuntare><documentSedinta>Hotarare</documentSedinta><numarDocument>10829/2018</numarDocument><dataDocument>2018-08-28T00:00:00</dataDocument></DosarSedinta><DosarSedinta><complet>C15 - civil, minori şi familie</complet><data>2018-06-05T00:00:00</data><ora>09:00</ora><solutie>Amână cauza</solutie><solutieSumar /><dataPronuntare xsi:nil="true" /><documentSedinta xsi:nil="true" /><numarDocument /><dataDocument xsi:nil="true" /></DosarSedinta><DosarSedinta><complet>C15 - civil, minori şi familie</complet><data>2018-05-08T00:00:00</data><ora>09:00</ora><solutie>Amână cauza</solutie><solutieSumar /><dataPronuntare xsi:nil="true" /><documentSedinta xsi:nil="true" /><numarDocument /><dataDocument xsi:nil="true" /></DosarSedinta></sedinte><numar>4362/4/2018</numar><numarVechi /><data>2018-02-21T11:45:00</data><institutie>JudecatoriaSECTORUL4BUCURESTI</institutie><departament>....</departament><categorieCaz>Minorisifamilie</categorieCaz><stadiuProcesual>Fond</stadiuProcesual><obiect>divorţ cu copii</obiect><dataModificare>2018-09-20T19:51:49.367</dataModificare><categorieCazNume>Minori şi familie</categorieCazNume><stadiuProcesualNume>Fond</stadiuProcesualNume></Dosar><Dosar><parti><DosarParte><nume>Marin Bogdan Alexandru</nume><calitateParte>Reclamant</calitateParte></DosarParte><DosarParte><nume>AUTORITATEA TUTELARĂ-PRIMĂRIA SECTOR 4 BUCUREŞTI</nume><calitateParte>Autoritate tutelară</calitateParte></DosarParte><DosarParte><nume>Marin Bianca Dana</nume><calitateParte>Pârât</calitateParte></DosarParte></parti><sedinte><DosarSedinta><complet>C15 - civil, minori şi familie</complet><data>2018-08-28T00:00:00</data><ora>09:00</ora><solutie>Respinge cererea</solutie><solutieSumar>Respinge actiunea principala, ca nesustinuta.
Disjunge cererea reconventionala de actiunea principala si acorda termen in vederea solutionarii cererii reconventionale la data de 01.10.2018, C15, ora 09.00, pentru cand partile au termen in cunostinta, urmand a fi citata Autoritatea Tutelara-Primaria Sector 4 Bucuresti.
Cu apel in termen de 30 de zile de la comunicare.
Pronuntata in sedinta publica, azi, 28.08.2018.</solutieSumar><dataPronuntare>2018-08-28T00:00:00</dataPronuntare><documentSedinta>Hotarare</documentSedinta><numarDocument>10828/2018</numarDocument><dataDocument>2018-08-28T00:00:00</dataDocument></DosarSedinta><DosarSedinta><complet>C15 - civil, minori şi familie</complet><data>2018-06-05T00:00:00</data><ora>09:00</ora><solutie>Amână cauza</solutie><solutieSumar /><dataPronuntare xsi:nil="true" /><documentSedinta xsi:nil="true" /><numarDocument /><dataDocument xsi:nil="true" /></DosarSedinta></sedinte><numar>4556/4/2018</numar><numarVechi /><data>2018-02-22T15:16:00</data><institutie>JudecatoriaSECTORUL4BUCURESTI</institutie><departament>....</departament><categorieCaz>Minorisifamilie</categorieCaz><stadiuProcesual>Fond</stadiuProcesual><obiect>divorţ cu copii</obiect><dataModificare>2018-09-20T22:46:22.253</dataModificare><categorieCazNume>Minori şi familie</categorieCazNume><stadiuProcesualNume>Fond</stadiuProcesualNume></Dosar><Dosar><parti><DosarParte><nume>Marcovici Petu Corina</nume><calitateParte>Reclamant</calitateParte></DosarParte><DosarParte><nume>AUTORITATEA TUTELARĂ-PRIMĂRIA SECTOR 4 BUCUREŞTI</nume><calitateParte>Autoritate tutelară</calitateParte></DosarParte><DosarParte><nume>Marcovici Bogdan</nume><calitateParte>Pârât</calitateParte></DosarParte></parti><sedinte><DosarSedinta><complet>C19 - civil, minori şi familie</complet><data>2018-09-25T00:00:00</data><ora>09:00</ora><solutie>Admite cererea</solutie><solutieSumar>Admite cererea de chemare în judecată precizată.
Admite cererea reconvenţională precizată.
Declară desfăcută prin acordul soţilor căsătoria încheiată între părţi. 
Ia act de înţelegerea părţilor cu privire la soluţionarea cererilor accesorii în sensul că:
Reclamanta va păstra numele dobândit prin încheierea căsătoriei. Autoritatea părintească privind pe minor  va fi exercitată în comun de către ambii părinţi.
 Stabileşte locuinţa minorului la domiciliul mamei din Bucureşti,  sector 4.
 Obligă tatăl să plătească în favoarea minorului o pensie de întreţinere în cuantum de 1 din venitul său net lunar, începând cu data pronunţării prezentei hotărâri şi până la majoratul beneficiarului. 
Încuviinţează tatălui să aibă legături personale cu minorul, prin luarea şi găzduirea acestuia la locuinţa sa şi cu obligaţia ca la sfârşitul programului să-l readucă la locuinţa mamei, conform următorului program:
-	în primul şi al treilea sfârşit de săptămână din fiecare lună, de vineri, ora 17.00 până duminică, ora 19.00;
-	în luna iulie a anilor pari şi în luna august a anilor impari;
-	o săptămână de Crăciun în perioada 23 – 30 decembrie în anii pari;
-	o săptămână de Paşti în anii impari;
-	ziua de naştere a minorului în anii pari;
-	ziua de naştere a pârâtului (12 aprilie), de la ora 10.00 la ora 19.00 şi între orele 16.00 – 19.00 dacă această zi este în cursul săptămânii.
Ia act că nu s-au solicitat cheltuieli de judecată.
Dispune restituirea în favoarea pârâtului a taxei judiciare de timbru de 100 lei achitată prin chitanţa nr.ACC000000735584/11.09.2018.
Definitivă.
Dispune înaintarea prezentei hotărâri către Serviciul de Stare Civilă al Primăriei Sectorului 4 Bucureşti pentru efectuarea cuvenitelor menţiuni pe actul de căsătorie.
Soluţie pusă la dispoziţia părţilor prin mijlocirea grefei instanţei, conform art. 396 alin. 2 din Codul de procedură civilă, astăzi, 25.09.2018.

</solutieSumar><dataPronuntare>2018-09-25T00:00:00</dataPronuntare><documentSedinta>Hotarare</documentSedinta><numarDocument>11724/2018</numarDocument><dataDocument>2018-09-25T00:00:00</dataDocument></DosarSedinta><DosarSedinta><complet>C19 - civil, minori şi familie</complet><data>2018-09-11T00:00:00</data><ora>09:00</ora><solutie>Amână pronunţarea</solutie><solutieSumar>Având nevoie de timp pentru a delibera, amână pronunţarea la data de 25.09.2018.
Pronunţată în şedinţă publică azi, 11.09.2018.
</solutieSumar><dataPronuntare xsi:nil="true" /><documentSedinta>incheiereAmanareinitialaapronuntarii</documentSedinta><numarDocument /><dataDocument>2018-09-11T00:00:00</dataDocument></DosarSedinta><DosarSedinta><complet>C19 - civil, minori şi familie</complet><data>2018-06-28T00:00:00</data><ora>09:00</ora><solutie>Amână cauza</solutie><solutieSumar /><dataPronuntare xsi:nil="true" /><documentSedinta xsi:nil="true" /><numarDocument /><dataDocument xsi:nil="true" /></DosarSedinta></sedinte><numar>4557/4/2018</numar><numarVechi /><data>2018-02-22T15:18:00</data><institutie>JudecatoriaSECTORUL4BUCURESTI</institutie><departament>....</departament><categorieCaz>Minorisifamilie</categorieCaz><stadiuProcesual>Fond</stadiuProcesual><obiect>divorţ cu copii</obiect><dataModificare>2018-10-02T11:11:29.637</dataModificare><categorieCazNume>Minori şi familie</categorieCazNume><stadiuProcesualNume>Fond</stadiuProcesualNume></Dosar><Dosar><parti><DosarParte><nume>Tuleu Mirela Maria</nume><calitateParte>Reclamant</calitateParte></DosarParte><DosarParte><nume>Tuleu Marin</nume><calitateParte>Pârât</calitateParte></DosarParte></parti><sedinte><DosarSedinta><complet>C15 - civil, minori şi familie</complet><data>2018-09-10T00:00:00</data><ora>09:00</ora><solutie>Respinge cererea</solutie><solutieSumar>Respinge actiunea, ca neintemeiata.
Cu apel in termen de 30 de zile de la comunicare. 
Pronunţată in şedinţa publică, azi, 10.09.2018.
</solutieSumar><dataPronuntare>2018-09-10T00:00:00</dataPronuntare><documentSedinta>Hotarare</documentSedinta><numarDocument>11210/2018</numarDocument><dataDocument>2018-09-10T00:00:00</dataDocument></DosarSedinta><DosarSedinta><complet>C15 - civil, minori şi familie</complet><data>2018-06-26T00:00:00</data><ora>09:00</ora><solutie>Amână cauza</solutie><solutieSumar /><dataPronuntare xsi:nil="true" /><documentSedinta xsi:nil="true" /><numarDocument /><dataDocument xsi:nil="true" /></DosarSedinta><DosarSedinta><complet>C15 - civil, minori şi familie</complet><data>2018-05-08T00:00:00</data><ora>09:00</ora><solutie>Amână cauza</solutie><solutieSumar /><dataPronuntare xsi:nil="true" /><documentSedinta xsi:nil="true" /><numarDocument /><dataDocument xsi:nil="true" /></DosarSedinta></sedinte><numar>4819/4/2018</numar><numarVechi /><data>2018-02-27T11:26:00</data><institutie>JudecatoriaSECTORUL4BUCURESTI</institutie><departament>....</departament><categorieCaz>Minorisifamilie</categorieCaz><stadiuProcesual>Fond</stadiuProcesual><obiect>divorţ fara copii</obiect><dataModificare>2018-11-24T17:05:33.55</dataModificare><categorieCazNume>Minori şi familie</categorieCazNume><stadiuProcesualNume>Fond</stadiuProcesualNume></Dosar><Dosar><parti><DosarParte><nume>Andonovici Angela</nume><calitateParte>Reclamant</calitateParte></DosarParte><DosarParte><nume>Andonovici Marian George</nume><calitateParte>Pârât</calitateParte></DosarParte><DosarParte><nume>AUTORITATEA TUTELARĂ PRIMĂRIA SECTOR 4 BUCUREŞTI</nume><calitateParte>Autoritate tutelară</calitateParte></DosarParte></parti><sedinte><DosarSedinta><complet>C19 - civil, minori şi familie</complet><data>2018-12-18T00:00:00</data><ora>09:00</ora><solutie>Admite in parte cererea</solutie><solutieSumar>Admite în parte cererea de chemare în judecată precizată.
Declară desfăcută căsătoria încheiată între părţi  din culpa exclusivă a soţului pârât.
 Reclamanta va purta în continuare numele dobândit prin încheierea căsătoriei.
Autoritatea părintească cu privire la minori va fi exercitată exclusiv de către mamă.
Stabileşte locuinţa minorilor la domiciliul mamei.
Obligă tatăl să plătească în favoarea minorilor o pensie de întreţinere în sumă de 520 lei, revenind suma de câte 260 lei lunar pentru fiecare copil, începând cu data introducerii cererii de chemare în judecată, respectiv 28.02.2018 şi până la majoratul beneficiarilor.
Obligă pârâtul să plătească reclamantei suma de 3.587 lei cheltuieli de judecată. 
Dispune înaintarea prezentei hotărâri, după rămânerea definitivă, către Serviciul de Stare Civilă al Primăriei Sectorului 4 Bucureşti pentru efectuarea cuvenitelor menţiuni pe actul de căsătorie.
Executorie de drept în privinţa modalităţii de exercitare a autorităţii părinteşti, locuinţei minorilor şi a pensiei de întreţinere stabilită în favoarea acestora.
Cu drept de apel în termen de 30 de zile de la comunicare, cererea urmând a fi depusă la Judecătoria Sectorului 4 Bucureşti.
Soluţie pusă la dispoziţia părţilor prin mijlocirea grefei instanţei, conform art. 396 alin. 2 din Codul de procedură civilă, astăzi, 18.12.2018.
</solutieSumar><dataPronuntare>2018-12-18T00:00:00</dataPronuntare><documentSedinta>Hotarare</documentSedinta><numarDocument>16184/2018</numarDocument><dataDocument>2018-12-18T00:00:00</dataDocument></DosarSedinta><DosarSedinta><complet>C19 - civil, minori şi familie</complet><data>2018-12-04T00:00:00</data><ora>09:00</ora><solutie>Amână pronunţarea</solutie><solutieSumar>Având nevoie de timp pentru a delibera, amână pronunţarea la data de 18.12.2018.
Pronunţată în şedinţă publică azi, 04.12.2018.

</solutieSumar><dataPronuntare xsi:nil="true" /><documentSedinta>incheiereAmanareinitialaapronuntarii</documentSedinta><numarDocument /><dataDocument>2018-12-04T00:00:00</dataDocument></DosarSedinta><DosarSedinta><complet>C19 - civil, minori şi familie</complet><data>2018-11-13T00:00:00</data><ora>12:00</ora><solutie>Amână cauza</solutie><solutieSumar /><dataPronuntare xsi:nil="true" /><documentSedinta xsi:nil="true" /><numarDocument /><dataDocument xsi:nil="true" /></DosarSedinta><DosarSedinta><complet>C19 - civil, minori şi familie</complet><data>2018-10-02T00:00:00</data><ora>12:00</ora><solutie>Amână cauza</solutie><solutieSumar /><dataPronuntare xsi:nil="true" /><documentSedinta xsi:nil="true" /><numarDocument /><dataDocument xsi:nil="true" /></DosarSedinta><DosarSedinta><complet>C19 - civil, minori şi familie</complet><data>2018-06-28T00:00:00</data><ora>11:00</ora><solutie>Amână cauza</solutie><solutieSumar /><dataPronuntare xsi:nil="true" /><documentSedinta xsi:nil="true" /><numarDocument /><dataDocument xsi:nil="true" /></DosarSedinta><DosarSedinta><complet>C19 - civil, minori şi familie</complet><data>2018-06-07T00:00:00</data><ora>09:00</ora><solutie>Amână cauza</solutie><solutieSumar /><dataPronuntare xsi:nil="true" /><documentSedinta xsi:nil="true" /><numarDocument /><dataDocument xsi:nil="true" /></DosarSedinta></sedinte><numar>4901/4/2018</numar><numarVechi /><data>2018-02-28T11:17:00</data><institutie>JudecatoriaSECTORUL4BUCURESTI</institutie><departament>....</departament><categorieCaz>Minorisifamilie</categorieCaz><stadiuProcesual>Fond</stadiuProcesual><obiect>divorţ cu copii</obiect><dataModificare>2019-03-15T15:54:46.037</dataModificare><categorieCazNume>Minori şi familie</categorieCazNume><stadiuProcesualNume>Fond</stadiuProcesualNume></Dosar><Dosar><parti><DosarParte><nume>MOLDOVAN TUDORICA ALINA</nume><calitateParte>Reclamant</calitateParte></DosarParte><DosarParte><nume>MOLDOVAN SEBASTIAN</nume><calitateParte>Pârât</calitateParte></DosarParte></parti><sedinte><DosarSedinta><complet>C19 - civil, minori şi familie</complet><data>2018-11-13T00:00:00</data><ora>09:00</ora><solutie>Constată perimată cererea</solutie><solutieSumar>
Admite excepţia perimării.
	Constată perimarea cererii de chemare în judecată.
Cu drept de recurs în 5 zile de la pronunţare, cerere de recurs care se depune la Judecătoria Sectorului 4 Bucureşti. 
	Pronunţată în şedinţă publică astăzi, 13.11.2018.

</solutieSumar><dataPronuntare>2018-11-13T00:00:00</dataPronuntare><documentSedinta>Hotarare</documentSedinta><numarDocument>14491/2018</numarDocument><dataDocument>2018-11-13T00:00:00</dataDocument></DosarSedinta><DosarSedinta><complet>C19 - civil, minori şi familie</complet><data>2018-04-19T00:00:00</data><ora>09:00</ora><solutie>411 NCPC/242 CPC</solutie><solutieSumar>În temeiul art. 411 alin. 1 pct. 2 din Codul de procedură civilă, suspendă judecata pentru lipsa părţilor.
Cu drept de recurs separat pe toată durata suspendării.
Pronunţată în şedinţă publică astăzi, 19.04.2018.

</solutieSumar><dataPronuntare>2018-04-19T00:00:00</dataPronuntare><documentSedinta>incheiereSuspendare</documentSedinta><numarDocument /><dataDocument>2018-04-19T00:00:00</dataDocument></DosarSedinta></sedinte><numar>5048/4/2018</numar><numarVechi /><data>2018-03-01T00:00:00</data><institutie>JudecatoriaSECTORUL4BUCURESTI</institutie><departament>....</departament><categorieCaz>Minorisifamilie</categorieCaz><stadiuProcesual>Fond</stadiuProcesual><obiect>divorţ fara copii</obiect><dataModificare>2018-11-27T17:43:44.23</dataModificare><categorieCazNume>Minori şi familie</categorieCazNume><stadiuProcesualNume>Fond</stadiuProcesualNume></Dosar><Dosar><parti><DosarParte><nume>Neagu Ionelia</nume><calitateParte>Reclamant</calitateParte></DosarParte><DosarParte><nume>Neagu Gheorghiţă</nume><calitateParte>Pârât</calitateParte></DosarParte></parti><sedinte><DosarSedinta><complet>C2 - civil şi executări (fost minori şi familie)</complet><data>2018-09-24T00:00:00</data><ora>09:00</ora><solutie>Admite cererea</solutie><solutieSumar>Admite cererea. 
Declară desfăcută căsătoria încheiată între părţi la data de 15.11.1996 şi trecută în registrul de stare civilă al Primăriei Sectorului 4 Bucureşti, sub nr. 1804, prin divorţ din culpa exclusivă a soţului pârât.
Reclamanta va reveni la numele avut anterior încheierii căsătoriei, respectiv acela de Zaharia.
Dispune înaintarea prezentei hotărâri, după rămânerea definitivă, către Serviciul de Stare Civilă al Primăriei Sectorului 4 Bucureşti pentru efectuarea cuvenitelor menţiuni pe actul de căsătorie.
Ia act că nu s-au solicitat cheltuieli de judecată.
Cu drept de apel în termen de 30 de zile de la comunicare, cererea urmând a fi depusă la Judecătoria Sectorului 4 Bucureşti.
Pronunţată în şedinţă publică, astăzi, 24.09.2018.
	
</solutieSumar><dataPronuntare>2018-09-24T00:00:00</dataPronuntare><documentSedinta>Hotarare</documentSedinta><numarDocument>11684/2018</numarDocument><dataDocument>2018-09-24T00:00:00</dataDocument></DosarSedinta><DosarSedinta><complet>C2 - civil şi executări (fost minori şi familie)</complet><data>2018-07-10T00:00:00</data><ora>09:00</ora><solutie>Amână cauza</solutie><solutieSumar /><dataPronuntare xsi:nil="true" /><documentSedinta>incheieredesedinta</documentSedinta><numarDocument /><dataDocument>2018-07-10T00:00:00</dataDocument></DosarSedinta><DosarSedinta><complet>C2 - civil şi executări (fost minori şi familie)</complet><data>2018-05-22T00:00:00</data><ora>09:00</ora><solutie>Amână cauza</solutie><solutieSumar /><dataPronuntare xsi:nil="true" /><documentSedinta>incheieredesedinta</documentSedinta><numarDocument /><dataDocument>2018-05-22T00:00:00</dataDocument></DosarSedinta></sedinte><numar>5619/4/2018</numar><numarVechi /><data>2018-03-07T11:43:00</data><institutie>JudecatoriaSECTORUL4BUCURESTI</institutie><departament>....</departament><categorieCaz>Minorisifamilie</categorieCaz><stadiuProcesual>Fond</stadiuProcesual><obiect>divorţ fara copii</obiect><dataModificare>2018-10-26T01:49:55.803</dataModificare><categorieCazNume>Minori şi familie</categorieCazNume><stadiuProcesualNume>Fond</stadiuProcesualNume></Dosar><Dosar><parti><DosarParte><nume>Proteasa Gheorghe Nicolae</nume><calitateParte>Reclamant</calitateParte></DosarParte><DosarParte><nume>Proteasa Elena</nume><calitateParte>Pârât</calitateParte></DosarParte></parti><sedinte><DosarSedinta><complet>C19 - civil, minori şi familie</complet><data>2018-10-16T00:00:00</data><ora>09:00</ora><solutie>Admite in parte cererea</solutie><solutieSumar>Admite în parte cererea de chemare în judecată.
Declară desfăcută din culpă comună căsătoria încheiată între părţi .
Pârâta va reveni la numele purtat anterior încheierii căsătoriei. Respinge cererea reclamantului de obligare a pârâtei la plata cheltuielilor de judecată ca neîntemeiată.
Dispune înaintarea prezentei hotărâri, după rămânerea definitivă, către Serviciul de Stare Civilă al Primăriei Sectorului 4 Bucureşti, pentru efectuarea cuvenitelor menţiuni pe actul de căsătorie.
Cu drept de apel în termen de 30 de zile de la comunicare, cererea urmând a fi depusă la Judecătoria Sectorului 4 Bucureşti.
 Soluţie pusă la dispoziţia părţilor prin mijlocirea grefei instanţei, conform art. 396 alin. 2 din Codul de procedură civilă, astăzi, 16.10.2018.
</solutieSumar><dataPronuntare>2018-10-16T00:00:00</dataPronuntare><documentSedinta>Hotarare</documentSedinta><numarDocument>12915/2018</numarDocument><dataDocument>2018-10-16T00:00:00</dataDocument></DosarSedinta><DosarSedinta><complet>C19 - civil, minori şi familie</complet><data>2018-10-02T00:00:00</data><ora>09:00</ora><solutie>Amână pronunţarea</solutie><solutieSumar>Având nevoie de timp pentru a delibera, amână pronunţarea la data de 16.10.2018.
Pronunţată în şedinţă publică azi, 02.10.2018.


</solutieSumar><dataPronuntare xsi:nil="true" /><documentSedinta>incheiereAmanareinitialaapronuntarii</documentSedinta><numarDocument /><dataDocument>2018-10-02T00:00:00</dataDocument></DosarSedinta><DosarSedinta><complet>C19 - civil, minori şi familie</complet><data>2018-06-28T00:00:00</data><ora>09:00</ora><solutie>Amână cauza</solutie><solutieSumar /><dataPronuntare xsi:nil="true" /><documentSedinta xsi:nil="true" /><numarDocument /><dataDocument xsi:nil="true" /></DosarSedinta></sedinte><numar>5910/4/2018</numar><numarVechi /><data>2018-03-12T09:29:00</data><institutie>JudecatoriaSECTORUL4BUCURESTI</institutie><departament>....</departament><categorieCaz>Minorisifamilie</categorieCaz><stadiuProcesual>Fond</stadiuProcesual><obiect>divorţ fara copii</obiect><dataModificare>2018-11-27T20:39:08.917</dataModificare><categorieCazNume>Minori şi familie</categorieCazNume><stadiuProcesualNume>Fond</stadiuProcesualNume></Dosar><Dosar><parti><DosarParte><nume>Garnet Liviu Vasile</nume><calitateParte>Reclamant</calitateParte></DosarParte><DosarParte><nume>AUTORITATEA TUTELARĂ-PRIMĂRIA SECTOR 4 BUCUREŞTI</nume><calitateParte>Autoritate tutelară</calitateParte></DosarParte><DosarParte><nume>Garnet Olivia Ionela</nume><calitateParte>Pârât</calitateParte></DosarParte></parti><sedinte><DosarSedinta><complet>C38 - civil, minori şi familie</complet><data>2018-10-18T00:00:00</data><ora>09:00</ora><solutie>Admite in parte cererea</solutie><solutieSumar>Admite în parte cererea.
Desface căsătoria părţilor încheiată la data de (...) şi înregistrată în Registrul de Stare Civilă al Primăriei Sectorului 4 Bucureşti sub nr. (...), din culpă comună.
Dispune păstrarea de către pârâtă a numelui dobândit prin căsătorie.
Dispune ca autoritatea părintească asupra minorei G.I.M., să fie exercitată în comun, de către ambii părinţi.
Stabileşte domiciliul minorei G.I.M., la mamă.
Obligă pârâtul la plata în favoarea minorei G.I.M., a unei pensii de întreţinere de 1/6 din venitul lunar net realizat, în bani, de la data pronunţării hotărârii (18.10.2018) şi până la majoratul minorei.
Încuviinţează pârâtului legături personale cu minora G.I.M., după următorul program: 
-	în fiecare week-end, sâmbăta şi duminica, de la ora 10.00 până la ora 12.30, într-un loc public, în prezenţa mamei
-	de ziua de naştere şi ziua onomastică a minorei, de la ora 17.00 până la ora 19.00, într-un loc public, în prezenţa mamei
-	pârâta îi va transmite reclamantului informaţii privind starea de sănătate a minorei, la efectuarea vaccinurilor facultative şi obligatorii, cu posibilitatea tatălui de a însoţi minora la medic
-	pârâta îl va informa pe reclamant în legătură cu schimbarea domiciliului în care locuieşte împreună cu minora
Obligă pârâta la plata către reclamant a sumei de 500 lei, cu titlu de cheltuieli de judecată, reprezentând taxă judiciară de timbru şi onorariu de avocat redus.
Cu drept de apel în termen de 30 zile de la comunicare, la Judecătoria Sectorului 4 Bucureşti. 
Pronunţată în şedinţă publică, astăzi, 18.10.2018.
</solutieSumar><dataPronuntare>2018-10-18T00:00:00</dataPronuntare><documentSedinta>Hotarare</documentSedinta><numarDocument>13162/2018</numarDocument><dataDocument>2018-10-18T00:00:00</dataDocument></DosarSedinta><DosarSedinta><complet>C38 - civil, minori şi familie</complet><data>2018-10-11T00:00:00</data><ora>09:00</ora><solutie>Amână pronunţarea</solutie><solutieSumar>Amână pronunţarea la data de 18.10.2018.
Pronunţată în şedinţă publică, astăzi, 11.10.2018.
